,name,date,rating,review,critic
0,nickkingofearth,"Mar 19, 2021",10,"<span>The album is experimental, soft, jazzy, deconstructed. Completely unexpected and I loved it.</span>",Positive
1,major_tom,"Mar 19, 2021",10,"<span>White Dress, Tulsa Jesus Freak, Dark But Just A Game: These are all very different and beautifully produced songs. Lana keeps getting better!</span>",Positive
2,NathandelRey,"Mar 19, 2021",10,"<span>Lana Make a perfect story, make me feel happy and sad, but in love; THKS Lana</span>",Positive
3,Panchogul,"Mar 19, 2021",10,"<span>Excelente trabajo, majestuoso en todo su esplendor, es difícil decidir si está a la altura de Norman **** Rockwell, el cual ha sido el mejor trabajo de Lana hasta la fecha, está al mismo nivel o quizás superior, pero nunca más abajo, valió la pena la espera </span>",Positive
4,domenico629,"Mar 18, 2021",10,"<span>It’s a perfect album. It has a different vibe than NFR , it’s more quiet and soft , with a country vibe to it , but also a lot more personal.<br/>It’s definitely one of the most mature album from Lana , it seems like a transition to something that will be more precise and outstanding , love it.</span>",Positive
5,Missqueen,"Mar 19, 2021",10,"<span>GOD IS A WOMAN, But Lana is god BECAUSE, is god , the album is **** amazing guys ❤️❤️❤️❤️</span>",Positive
6,carolinakinter,"Mar 19, 2021",10,"<span>Lana del Rey se consagra como A-List e vai se nivelando aos artistas que ela presta homenagem. A magnitude do álbum combina com a vulnerabilidade que ela mostra em algumas músicas. Impecável em toda a discografia, consegue deixar o público cada vez mais animado e contente com o trabalho a cada novo lançamento.</span>",Positive
7,Gsp,"Mar 19, 2021",10,<span>Che dire..Lana del Rey non delude mai. È una garanzia. Un bel gioiellino da ascoltare attentamente. Sta perfettamente al passo con i suoi lavori precedenti.</span>,Positive
8,popeart,"Mar 18, 2021",10,Love.Didn’t know what to expect going into this but damn she never disappoint.,Positive
9,LucasAG,"Mar 19, 2021",10,"<span>Incredible experience, amazing vibe. Another album that has positively pleased your impeccable discography.Lana continue h Thank You Lana Del Rey</span>",Positive
10,rafabcanuto,"Mar 19, 2021",10,<span>The best album ever. She is the best singer and songwriter of our generation!</span>,Positive
11,imhcasper,"Mar 19, 2021",10,"<span>talented, brilliant, incredible, amazing, show stopping, spectacular, never the same, totally unique, completely not ever been done before, unafraid to reference or not reference, put it in a blender, **** on it, vomit on it, eat it, give birth to it.</span>",Positive
12,PauloDelRey,"Mar 19, 2021",10,"<span>Lana Del Rey, continua sendo fiel ao estilo musical do seu álbum antecessor, mas dessa vez ela aborda assuntos mais pessoais, deixando de lado um pouco do seu amor pela cena americana, Chemtrails Over The Country Club é mais do que nunca, o álbum mas pessoal de Del Rey.</span>",Positive
13,eleveneggos,"Mar 19, 2021",10,<span>simplesmente tudo pra mim<br/>perfeito<br/>Jack Antonoff e Lana del Rey comeram o cu de todo mundo com esse álbum</span>,Positive
14,Lizzypatton,"Mar 19, 2021",10,"<span>Ele sofre um pouco por ser o sucessor do norman e sair perdendo na comparação, mas é um belíssimo álbum.</span>",Positive
15,Garfunkel,"Mar 19, 2021",10,"<span>Simply divine , Her songwritinf sticks out in the best way imaginable and her beautiful voice haunts you .</span>",Positive
16,Mati_2003,"Mar 19, 2021",10,"<span>Arte, lo amo, Taylor Swift y Lana Del Rey son las patronas, urge que colaboren </span>",Positive
17,Anjaneya99,"Mar 19, 2021",10,"<span>Lana has always created albums so relaxing that you could literally drown out all your troubles at one listen, and this is what chemtrails does. A relaxed album with such sweet moments in life. beautiful</span>",Positive
18,ViktorWong,"Mar 18, 2021",10,"<span>This is the best album's Lana del Rey New sounds, this is amazing I love every song<br/>Wild at heart so majestic</span>",Positive
19,GLCC2431,"Mar 19, 2021",10,"<span>Lana Del Rey solo hace arte, un álbum con unas letras profundas que demuestran el talento de composición tanto de Lana como de Jack y la producción a cargo de estos 2 es toda una maravilla.</span>",Positive
20,kaana948,"Mar 19, 2021",10,her best album perioddddddddttttttttaaabbbbcccdddeefefffgggggghhhhhhiiiiiijjjjjjjjkkkkk,Positive
21,Khalilalashy,"Mar 19, 2021",10,"<span>Absolutely wonderful! Lana keeps repurposing her authentic melodies, with a haunted and ethereal ecstatic!! White Dress and Wild at Heart could be one of the best tracks off the album.</span>",Positive
22,sammiebrond,"Mar 19, 2021",10,<span>there are no skips. lana once again proved that she is the Queen of Alternative. coming for Album of the Year</span>,Positive
23,rickpr99,"Mar 19, 2021",10,"<span>Difficult to top NFR!, but very well produced and arranged (and very folky)</span>",Positive
24,Artuugongu,"Mar 19, 2021",10,<span>After NFR I didn’t except her to outdo herself but this album has proved me wrong. Perfect!!!</span>,Positive
25,joanbaez4,"Mar 19, 2021",10,<span>This is her best work. Very beautifully written and impactful. Bless the reigning queen of Alternative</span>,Positive
26,0987,"Mar 19, 2021",10,"<span>Thank God for Lana Del Rey and her music. Best songs: White Dress, Wild at Heart, title track and Dance Till We Die.</span>",Positive
27,caiotidek,"Mar 19, 2021",10,<span>Ela dança como Jesus em tempo de caos. Obrigado por esse incrível e impecável álbum. Você se reinventou e mostrou para todos como se faz um retorno triunfal.</span>,Positive
28,lucaswho,"Mar 19, 2021",10,<span>Masterpiece. The peak of everything that lana ever made. All her decade-long work culminated to this one album.</span>,Positive
29,DiegoMoura,"Mar 19, 2021",10,<span>Her best work cohesively. Stunning piece of art. This is del Rey breaking barriers</span>,Positive
30,LordNaxus,"Mar 19, 2021",10,"<span>Again, Lana has made a work of art! It made feel nostalgic about my adolescence and childhood</span>",Positive
31,CharlesT,"Mar 19, 2021",10,"<span>beautiful lyrics and melodies, really inspiring and hopeful to be more positive from sadness.</span>",Positive
32,Aaron20,"Mar 19, 2021",10,<span>Only chemtrails over the country club could be the next album after the piece of art how was norman F rockwell</span>,Positive
33,iaggo,"Mar 19, 2021",10,"<span>Lana del rey is back, and she's never been gone at all. love the album, it's beautifully written and sang and done ❤️</span>",Positive
34,marcelemedeiros,"Mar 19, 2021",10,"<span>lana del rey é tudo que a industria precisa para revolucionar a música. seus álbuns não possuem semelhanças pois todos são únicos, diferenciados e coesos de acordo com o momento da artista. é impressionante como ela vem se superando cada vez mais.</span>",Positive
35,ryanrodz,"Mar 19, 2021",10,"<span>Amazing, truly another great work by this artist of the decade and of the century</span>",Positive
36,Vitalinap,"Mar 19, 2021",10,<span>It's THE ART for me. I feel invited to her country club listening to her life stories. I feel very sorry for people who aren't feeling this album because it's a pure masterpiece.</span>,Positive
37,itsneitan,"Mar 19, 2021",10,"<span>This album it's a melody of the heaven, the track dark but just a game is the best of the album!!!</span>",Positive
38,Lflhhlfok,"Mar 19, 2021",10,"<span>One of her best albums, lyrically, melodically and emotionally. It's raw and deep</span>",Positive
39,alexrbertsx,"Mar 19, 2021",10,<span>this album is alternative-pop perfection. lana has outdone herself once again</span>,Positive
40,whoisgaby,"Mar 19, 2021",10,<span>I cannot explain the way I felt listening this masterpiece for the first time. Lana delivered to us a great album. Love Lana Forever.</span>,Positive
41,robertdlh,"Mar 19, 2021",10,<span>showing once again that her artistry is unmatched and that she is the best lyricist of our generation</span>,Positive
42,Vinis,"Mar 19, 2021",10,"<span>Seu maior acerto aqui, é não tentar fazer um 'novo NFR!'. Em Chemtrails Lana da um passo a mais e, apesar de mais contido que seu antecessor, Lana brilha igualmente nesse novo registro, sempre impecável, com voz e melodias que abraçam o ouvinte. Destaques para White Dress, Yosemite e a faixa título.</span>",Positive
43,anderlisboa,"Mar 19, 2021",10,"<span>Sinceramente, Lana del Rey se superou nesse álbum, por mais que eu acompanhe ela a 4 anos, esse foi o álbum que mais me surpreendeu!</span>",Positive
44,Zinedi,"Mar 19, 2021",10,Me encantaEs perfectoYa es de mis favoritos Es un excelente trabajoEs una joya,Positive
45,Victor1903,"Mar 19, 2021",10,"<span>Lana del rey presents us with a melancholic album, where we can see spectacular lyrics with those particular sounds of wool. I think that confirms that it is progressing, it is improving, with a concrete beginning With White Dress and a quiet closure with For Free. This album had my expectations high and met most of these</span>",Positive
46,Afonsy,"Mar 19, 2021",10,<span>a masterpiece!!!!!!!!!!!!!!!!!!!!!!!!!!!!!!!!!!!!!!!!!!!!!!!!!!!!!!!!!!!!!!!</span>,Positive
47,Brunopattersonp,"Mar 19, 2021",10,"<span>it's a soft hippie melody album. made me cry more than once.. as I listened to this my body trembled I felt love, depth, maturity, and a feeling of nostalgia the album is alternative and art at its maximum expression I will sing at full lungs a couple of these songs..</span>",Positive
48,augustasmsn,"Mar 19, 2021",10,"<span>although the standarts that NFR set were pretty high, i believe that they were fulfilled perfectly. the album is beautifully produced, the lyrics are deep, personal and healing. i feel that this record showcases her best and most advanced vocals yet! 10/10</span>",Positive
49,vitoti,"Mar 19, 2021",10,"<span>A Lana entregou TUDO nesse album! Certamente, AOTY! Uma das melhores compositoras da história!</span>",Positive
50,Sadbaby11,"Mar 19, 2021",10,"<span>Beautiful simphony, lyrics awesomes this álbum is only pure art by the princess of California ♥️</span>",Positive
51,theuxxxxxx,"Mar 19, 2021",10,"This album is totally perfect, the sound and evolution of the alternative / indie queen is totally remarkable since Norman **** Rocwkell",Positive
52,carolbetini,"Mar 19, 2021",10,"<span>mais um trabalho impecável de lana del rey, ela é muito artista sou apaixonada pelo trabalho dela</span>",Positive
53,gaveriel,"Mar 19, 2021",10,"Lana’s newest album that is concise in it’s sequencing, and diaristic in it’s writing. It’s also unafraid to look at the entirety of her life (up until this point), and write about it honestly. The content here is different in many ways, without sacrificing the subject matter she’s well-known for. More importantly, the perspective here is irrevocably altered. Lana’s sound here isn’t channeled or reflected by the waves on Venice Beach, or the hectic noise of a New York borough. Here, Lana’s poetry undulates over the Great Plains and America’s most famous national park. The record is informed by experiences stretching from Lana’s late teenaged years (when she first discovered her passion for music), to recent trips that have taken her to Oklahoma, Nebraska, and the like. These places and the freedom they offered from the grip of L.A.’s celebrity culture and it’s suffocating sunlight, are the inspirations behind Lana’s turn to more stripped-back, instrument-driven backing production. After several albums with lush, baroque Wall-of-Sound production, Lana seems to have lost her fascination with the associations such sound has with the circuses and decadence of Hollywood’s past. This seems to have inspired her return (partially) to the music that she made before her breakthrough. An eclectic, rock-ish band, clearly played live in studio, backs her voice on almost every track. The feedback frequently lingers for a few seconds after each song’s closings. Lana’s songwriting is still concerned with twisted love, being held captive by the fame machine that actively participated in the destruction of her idols, and her contemporaries. Her rumination isn’t limited to these ideas, as she sings about her connection to God, an insatiable hunger for experiencing new surroundings and people. She invites people to become part of her personal narrative on collaborative tracks, like the uncredited Nikki Lane on Breaking Up Slowly, and Zella Day with Weyes Blood on the ascendant Joni Mitchell cover, For Free. The perspective is entirely new on Chemtrails, even as she takes snippets of melody and lyrics from past work to rework and reinterpret in her present state of freedom. She delights in narrating this chapter of her life while acknowledging the darkness it took to get here in the first place. In fact, she respects and even gives thanks to the struggle, rather than pretend she’s too far past it to care. Ultimately, this record is about Lana returning to her roots after she accomplished everything she wanted as a young 20-something. Not to assure herself that it was all worth it, but to take the stories she doesn’t want to be left behind, and to bring them with her as she decides who to be. Without the exclusive Complex interviews, the award shows, or even the respect of the general public that characterized much of her interaction with the world up until a year ago. She celebrates her ability to escape the world that was on fire in NFR! , in the song Wild at Heart. The fire-and-brimstone of 2019 L.A. she wrote dirges about couldn’t my kill her. Wild at Heart samples the song How to disappear from her previous record, in which she relates her acceptance of the stifling setting of a city that was dying all around her. In Wild at Heart, the breakdown from How to disappear transforms the quiet Chemtrails track into a beautiful declaration of how she fled the paparazzi, the hell of endless summer, and the criticism of vicious strangers that could have very well been her end. She didn’t evaporate into the coastal heat at all. Lana chose to seek better pastures, and by extension, new inspiration for her art. If Chemtrails is the result, it was the best decision she’s ever made.",Positive
54,tulsalanafreak,"Mar 20, 2021",10,<span>Lana once again surprised me with her amazing songwriting skills and new sounds. The production on this album is very interesting in a good way. Lana deserves the world!</span>,Positive
55,Newroz,"Mar 19, 2021",10,Lana..is so artistic. I do not know what would be the right word to describe her craft/artistry. all I know is that it is about time to move on from Mariners Apartment Complex and follow the Chemtrails Over the Country Club what a queen goddess,Positive
56,gdelgen12,"Mar 19, 2021",10,<span>She improved her vocals so much!!! I’m proud of her</span>,Positive
57,HausOfBabylonia,"Mar 19, 2021",10,"Following the critically acclaimed NFR! with its roaring soundscapes and profound lyrics Chemtrails constitutes a new chapter in Lana Del Rey‘s catalog, setting the mood for her projects yet to come. She is ""Wild At Heart"" now and has left the tumultuous city L.A., and on her musical trip to the Midwest (noticeable by the enormous amount of acoustic guitar compared to prior albums) she gathers her closest family around herself. Escaping the West Coast, breaking up slowly with the woman that once drowned in the melancholy of Americana and hopeless romance she is on the move, and although she describes the album as a place of ""standing still"", songs like ""Not All Those Who Wander Are Lost“ remind us that she is on a mission: the muse of so many recent alternative songwriters is redefining and relocating herself musically as well as lyrically, but not without being reminiscent of her past self.Album opener ""White Dress"" may be THE highlight on the record and shows Del Rey vocally performing in a completely new way. Her voice close to breaking, she reincarnates the Lizzy Grant era: it seems that she is aware of the whole Del Rey timeline, who she was and who she is, but the question remains who she will be? We cannot guess at this point, but ""Dance Till We Die"" reminds us that we haven’t seen the last of her, and that Chemtrails is only the first chapter of a new era, a new departure on the way to her becoming a timeless classic and a junction of the culture.",Positive
58,NoeJimenez99,"Mar 19, 2021",10,<span>I love this </span>,Positive
59,luisgera640,"Mar 19, 2021",10,"<span>Probably her most authentic work to date. Its folky and country, but Lana is inspired by this specific genre of music, Americana. From White Dress, to Wild at Heart, to For Free, this album is perfection and will most likely will give Lana her fest Grammy win.</span>",Positive
60,Animadoria,"Mar 19, 2021",10,"<span>Great album. Great vocals, instrumentals, and the lyrics do not disappoint.</span>",Positive
61,RayAshes,"Mar 19, 2021",10,"<span>love her work on this album , especially that it feels you’re listening to all of her previous albums in one album I just can’t complement this album more it’s great and she DELIVERED.</span>",Positive
62,lanaczechr,"Mar 19, 2021",10,"<span>this is masterpiece! lana is the best artist of our generation. it was slightly different, but really beautiful!</span>",Positive
63,liborstukavec,"Mar 19, 2021",10,<span>chemtrails is an insanely beautiful album by our talented lana del rey! thank you for this:)</span>,Positive
64,xLuksssx,"Mar 19, 2021",10,<span>it's a good album with a lot of different songs. the lyrics are poetic as one would expect from Lana and the melodies are beautiful. I love it.<br/>One of her best albums</span>,Positive
65,santipullas,"Mar 19, 2021",10,"Un álbum que habla sobre la fama y sus consecuencias, Lana Del Rey ha madurado tanto en lírica como en producción. Excelente álbum.",Positive
66,Danau,"Mar 19, 2021",10,"<span>Omg. I like this album all song is favorite. Its better NFR, but nft too very beautiful</span>",Positive
67,Manuh1596,"Mar 19, 2021",10,<span>Every single song of this album is perfect and beautiful!!! I realy love it!!!!</span>,Positive
68,Gabrielbbb,"Mar 19, 2021",10,"<span>Um álbum maravilhoso e muito bem produzido e composto, ele migra e muda os estilos a cada música sem parecer bagunçado ou forçado é algo natural, perfeito.</span>",Positive
69,LuqmanSazali,"Mar 19, 2021",10,"This album make me feel so nostalgic and sexy at the same time it doesn’t make sense. I wished it had more songs like Tulsa Jesus Freak but I am not mad at all because all the other songs are perfect in their own way. Its without a doubt one of her most cohesive body of work. The entire album flows perfectly. I’ve been listening to the album since it came out and I still haven’t been able to choose a favorite but Tulsa Jesus Freak, White Dress and Yosemite is definitely top 3.",Positive
70,deivcouto,"Mar 19, 2021",10,"<span>chemtrails isn’t just an album, it’s an art form, a lifestyle, a religious study, some might even say a part time career. it’s the essence of the album that capture the beauty of lana; lana is the world and the world is lana</span>",Positive
71,Beactress,"Mar 19, 2021",10,<span>Fantástico. Obra prima atemporal. Lana Del Rey sempre segue se superando. Me orgulho de ser fã de uma das melhores artistas do século!</span>,Positive
72,gabescobar,"Mar 19, 2021",10,"<span>Lana presents us a new album, with romantic rhythms, mixed with county sounds, simply amazing, this album presents captivating melodies and only instrumentals, that hellport you to a new world. The songs have beautiful lyrics, with an extraordinary feeling, and with Lana's voice they seem like the songs of a siren.</span>",Positive
73,Jhonathandiaz,"Mar 19, 2021",10,"Madre del alternativo, nos trajo su nueva biblia, me encanta demasiado, lírica y estéticamente",Positive
74,Kuddy,"Mar 19, 2021",10,"<span>This is one of her best album, probably in her top 3 with UV and NFR.<br/>Each sound is a different genre and sound, different instruments and music make up.<br/>It's a very worthwhile and interesting listen - deserves the #1 spot in the UK and US.</span>",Positive
75,Davi_Angelo,"Mar 19, 2021",10,"<span>Este álbum está literalmente perfeito, eu amo a lana pois ela sempre sabe o que faz, álbum do ano sim.</span>",Positive
76,angrybibs,"Mar 19, 2021",10,"<span>Lana del Rey never disapont us.<br/>Yosemite is the most incredible song ever.<br/> <br/>Thaks lana for bring me back 1% of happiness in middle of the chaos</span>",Positive
77,bribridi,"Mar 19, 2021",10,"<span>The best of Lana Del Rey. She is the greatest artist of the decade and one of the biggest of the history. This album is just perfect! It made me feel with her and her friends in the country club. It's intimate, beautiful and organic. I can't wait for what lana's doing coming next... because she is truly her now.</span>",Positive
78,Kevwoolridge,"Mar 19, 2021",10,"COTCC tiene sonidos sensuales, melancólicos, alegres, me recuerda un poco a NFR ya que los sonidos de la banda y algunas letras me recuerdan a su antecesor, estoy encantado!! 10/1000",Positive
79,billnai,"Mar 19, 2021",10,"<span>the best 2021 album so far! it's perfect to listen and soooo good, I could listen to this album for the rest that I wouldn't complain.</span>",Positive
80,marcostrs,"Mar 19, 2021",10,"<span>it's an incredible album, I feel privileged to be able to listen, Lana del Rey is an amazing, insightful and talented artist, deserves aoty for this masterpiece she gave us, this album should be 100/100 for everyone</span>",Positive
81,PaulinaPolinius,"Mar 19, 2021",10,"<span>This album is something new, new breath. Lana is going further and yas, she made it!</span>",Positive
82,lanavx,"Mar 19, 2021",10,<span>lana sempre entregando trabalho de qualidade. este álbum esta simplesmente impecável!!!!!</span>,Positive
83,iconique-,"Mar 19, 2021",10,"<span>talented, brilliant, incredible, amazing, show stopping, spectacular, never the same, totally unique, completely not ever been done before, unafraid to reference or not reference, put it in a blender, **** on it, vomit on it, eat it, give birth to it.</span>",Positive
84,Deny_Pope1,"Mar 19, 2021",10,"<span>Definitely the best album Elizabeth has ever made, it has completely innovated, the poetic lyrics, Jack and Lana make an incredible duo.  The best track is Tulsa Jesus Freak</span>",Positive
85,sickbxo,"Mar 19, 2021",10,"Essa álbum é muito perfeito, tem tudo pra ganhar o GrammyEu não consigo decidir qual é a melhor música do álbum, é muito difícil, me deixou sem palavras",Positive
86,llteusll,"Mar 19, 2021",10,"<span>Quando a gente acha que não pode vir um trabalho melhor... Boom! Chemtrails Over The Country Club, simplesmente perfeito do começo ao fim.</span>",Positive
87,TLIC,"Mar 19, 2021",10,"<span>every song is so f****ng perfect, the whole album it's a trip to a new whole world, the production sounds expensive and we don't have to talk about the lyrics, it's simply perfection.</span>",Positive
88,leodelreyz,"Mar 19, 2021",10,"<span>Perfect album! Lana was able to deliver everything we fans wanted, the vocals are perfect, everything is beautiful.</span>",Positive
89,puzzzywagon,"Mar 19, 2021",10,"<span>so beautiful and hardcore lana writing skills, you ⚠️AVISO</span>",Positive
90,ERIKMRZ,"Mar 19, 2021",10,"<span>magnifico, explendida, la lirica, melodias, minimalismo,sencillo, nostalgico, lana demuestra que cada vez se supera a si misma, su album mas alternativo por fin logra captar  esa esencia indie</span>",Positive
91,shrutia,"Mar 19, 2021",10,<span>This album is spectacular. Lana outdid herself once again. She cannot make a bad song.</span>,Positive
92,Br_,"Mar 19, 2021",10,"<span>Um álbum muito tranquilo e centrado que revela os fragmentos mais pessoas de Lana não apenas como artista, mas também como mulher.</span>",Positive
93,htriv,"Mar 19, 2021",10,"<span>incredible lyrics, beautiful harmonies, easily the best album I've heard in years</span>",Positive
94,darielisssc,"Mar 19, 2021",10,"<span>This is a masterpiece, it's different from the other albums but it's completely art</span>",Positive
95,AlexRiverLiu,"Mar 19, 2021",10,"Am American folk masterpiece with a unique indie-pop Beauty. Lana channel the own album in different style from its predecessor Norman **** Rockwell! But with our losing it’s grandiosity. Sure, it is a more personal and intimate experience for the audience but I think and have always been adhere to focus on the art work itself instead of focusing on the controversy and personal life of the artist which I consider as a profanity to the artwork. So as a audience who enjoy her music and insisted to stay away from her personal life. I genuinely enjoyed and enjoying the album and think most reviewers underscored the album.",Positive
96,Ipokik13,"Mar 19, 2021",10,"<span>Es el mejor álbum que a tenido Lana después de lust 4 life, agradezco a dios por tenerla con vida, agradezco a Instagram por sus fotos, agradezco a mi mano por las pajas, y que bendigan a la tuerca de la llanta del camión que llevo la cama a la casa de los abuelos para poder realizar el acto sexual y así puedan consevir a lana del rey, espero que gane grammy</span>",Positive
97,PabloR,"Mar 19, 2021",10,"OMG, Miss Lana has given us one of her best albums! Full album is absolutely gorgeous, she has improved her voice, now she’s singing like angels does in heaven! I truly love this album. Just a masterpiece. I’m hoping Album of the year nomination already! Love, Pablo",Positive
