,name,date,rating,review,critic
443,altrnvv,"Mar 19, 2021",10,"<span>Her best work to date, she’s truly found her sound and has put out perfection</span>",Positive
444,muaudio,"Mar 19, 2021",10,"<span>es la deeva, amamos como usó el folk ciaooooooooooooooooooooooooooooooooooo</span>",Positive
445,erickdelrey,"Mar 19, 2021",10,"<span>OMG, this is a masterpiece, everyone should listening this album, im so pround of u Lana</span>",Positive
446,virghoo,"Mar 19, 2021",10,"A great album. No skips, just pure fantasy and dreams.Del Rey really produced and amazing body of work.",Positive
447,PedroBittencout,"Mar 19, 2021",10,"This album is an icon, it manages to bring peace to your soul, your songs are very well done, the best.",Positive
448,Okeynayamana,"Mar 19, 2021",10,"<span>Lana Del Rey deserves better judgment because she gave the best works out of the table. I love the way it relates to her songs released when she uses the moniker ""May Jailer"". It's indie-folk. Truly a QUEEN OF INDIE.</span>",Positive
449,Petistasafada,"Mar 19, 2021",10,"<span>omg<br/>album of the year. This album is impeccable from start to finish, dance till we die, what a song!</span>",Positive
450,gabrielapgoes,"Mar 19, 2021",10,"<span>shes clever, shes brilliant, intelligent, shes the moment.<br/>she is lana del rey.</span>",Positive
451,girliexoxoxo,"Mar 19, 2021",10,<span>Love it. It’s really a great album. I love it. Iiiiiiiiiiiiiiiiiiiiiiiioiiidjdjjxijxjxjjxxhxhh is going insane and he doesn’t have a good idea about how he can do that but he doesn’t have a good job at that time lol I tyy. Sorry. Had to spam to get it to post</span>,Positive
452,romansrevenge,"Mar 19, 2021",10,"<span>some of her best work. absolutely stunning, a skipless album. tulsa jesus freak and wild at heart are the gems of this album in my opinion. lana does it again!!! gorgeous.</span>",Positive
453,feer_hg,"Mar 19, 2021",10,"<span>Es como si Norman **** Rockwell y Ultraviolence hubieran tenido un hijo. Es album es una combinación entre la musicalidad de canciones como California y la letra de canciones como Black Beauty, lo cual producen un resultado sublime.</span>",Positive
454,Alec1905r,"Mar 19, 2021",10,"<span>When I thought Lana couldn't give us anything better than NFR anymore, she comes with a really impressive and powerful album, Stunning from start to finish, an album where she is at her best  And it guides us in perfect folk, country and alternative harmony</span>",Positive
455,rafaelflora,"Mar 19, 2021",10,"<span>Lana’s follow-up to her previous ballad Norman **** Rockwell! stays cohesive, with the strong lyricism that she’s known for and cosy, hearted and precious instrumentals that fills her songs with grandiosity.</span>",Positive
456,marcelomendoza,"Mar 19, 2021",10,"<span>It’s one of the best album ever, thank you lana for<br/>always make art, your work should be more recognized, i love u</span>",Positive
457,Redpricho,"Mar 19, 2021",10,<span>Sin duda una experiencia magia y maravillosa. Con este álbum lana del rey se declara como una verdadera artista en la industria</span>,Positive
458,leonthebest15,"Mar 20, 2021",10,"This album is pure and brilliant. I love it, it's perfection. I love Lana and Jack, thank you for the masterpiece!",Positive
459,bellymb,"Mar 19, 2021",10,<span>An amazing album that shows a lot of personal growth. Every song has replay value and absolutely no skips. In with this album.</span>,Positive
460,Urielpadilla27,"Mar 19, 2021",10,De nuevo Lana nos volvió a dar un álbum muy maravilloso lleno de canciones muy geniales y con ritmos muy hermosos Lana a desmontado ser una cantante muy buena en su trabajo,Positive
461,zsasa,"Mar 19, 2021",10,"<span>Great work by Lana, this album one of the best album in this year. Lana Del Rey is fantastic woman.</span>",Positive
462,Stefano12,"Mar 19, 2021",10,"Chemtrails no decepcionó, el sucesor de Norman es todo lo que se esperaba de Lana Del Rey",Positive
463,karenxc,"Mar 19, 2021",10,"<span>It gets better everytime!!!<br/>I'm truly proud of her work, this album feels nostalgic and personal in the most beautiful way, the kind of album I want to listen to get inspired or when I'm feeling homesick.</span>",Positive
464,Taylanastan,"Mar 20, 2021",10,<span>Once again Lana did it. The album is very beautiful. Obsessed. It is very atmospheric and songwriting is so poetic. 10/10 easily</span>,Positive
465,bernasmendes,"Mar 19, 2021",10,"<span>After the critically acclaimed NFR! the hype of this album was huge, and the expectations met the reality for sure. Magic happens when Lana and Jack work together, and no one can deny it. Chemtrails is so genuinely pure, so raw, so effortlessly beautiful and out of this world. I'm out of words. I'm just glad I live in the same era as Lana del Rey.</span>",Positive
467,IrvinSwift,"Mar 20, 2021",10,"<span>The new álbum of the year, Justice wishes, lana hizo una joya de album el mejor</span>",Positive
468,cxnfusedminds,"Mar 19, 2021",10,"<span>Stunning production, the production is more complex than it may seen at first. There’s no weak song, and they reveal its secrets with repeated listenings</span>",Positive
469,hgerik,"Mar 20, 2021",8,"With ""Chemtrails Over The Country Club"" Lana proves again that she can compete with other recent artists due to her excellent songwriting skills. Throughout the Album you can hear songs from different genres, with different styles, while you may not like a few of them, you for sure will love other songs to heaven. Since some songs like ""White Dress"" are to experimental for MY taste I need to take some points there.But no matter a contender for Album of the Year at the next Grammy Awards so far, predictly gonna be hard competing with Swifts ""Evermore"" due they both have a huge alternative/folk touch.",Positive
471,ktoverthe,"Mar 19, 2021",10,"Lana siempre nos sorprende con sus letras tan profundas y pensadas que te hacen sentir que eres el protagonista de la canción. Este albúm se encuentra en la línea de Norma F. Rockwell, pero mucho sentimental y sumergente. Es imposible no querer repetir una y otra vez. Como siempre Del Rey nos ha demostrado que junto a Jack Antonoff, posiblemente uno de los mejores productores contemporáneos, hacen un increíble equipo y no se cansan de satisfacer al fandom con sus obras maestras.",Positive
472,OsvaldoRomo24,"Mar 19, 2021",10,"<span>Este Álbum es maravilloso como cada álbum de Lana, esta vez todas las canciones cuentan con solo 2 escritores, Lana una de ellos, Es una artista espectacular</span>",Positive
473,Jojoudelrey,"Mar 19, 2021",10,"<span>Perfeito vocais e letras impecaveis que levam esse album a grandiosidade, wild at heart linda</span>",Positive
474,josueabsalon,"Mar 19, 2021",10,"<span>Lana nos sorprendió para bien. Me encanta ver el camino que va tomando y cómo va creciendo, lejos de volver a hacer algo como Born To Die</span>",Positive
475,peterptrv,"Mar 19, 2021",10,"<span>Its such an amazing album, Tulsa Jesus Freak and Dancing til we die are so good!!</span>",Positive
476,Lanaxme,"Mar 20, 2021",10,"<span>WHAOUH, this is incredible she change so much of style but I love that , continue like that Del Rey</span>",Positive
477,fusuy127,"Mar 19, 2021",10,Albüm o kadar güzel ki ne yazsam bilemiyorum ama yaz dedi diye yazıyorum yoksa yorum yapamayacak kadar beğendim,Positive
478,JonathasMykael,"Mar 19, 2021",10,"<span>Album of the year so far<br/>Lana Del Rey shows how far she took away her music and poetry. Now she is one of the bests singer in US history.<br/>with beautiful vocals, heavy eletric guitar, and soft piano, the album is right.</span>",Positive
479,vhictornss,"Mar 19, 2021",10,"<span>meu deus ela foi a f***na, amei a sonoridade do album, ficou coeso demais e lana mais uma vez sendo a rainha do alternativo</span>",Positive
482,blinkuot4,"Mar 19, 2021",8,"<span>her voice is so good, this album is sing by the same angels </span>",Positive
483,AnvorguesA,"Mar 19, 2021",10,"<span>Es un álbum completamente perfecto, me encantan todas las canciones y las letras, sin duda alguna Lana se supera casa vez más! Este álbum es arteeeee!!!!!!!</span>",Positive
484,MonikaBay,"Mar 19, 2021",10,<span>Queen is back<br/>Summertime has been my favorite song<br/>Her vocal is so much soothing</span>,Positive
485,carlittog10,"Mar 19, 2021",10,"<span>Lana is the biggest we have, in each album she manages to excel. Proud to be a fan!! SHE'S A QUEEN!!!!</span>",Positive
486,jaredsolana,"Mar 20, 2021",9,"<span>Es un muy buen álbum, aunque no siento que sea el mejor que ha sacado, en lo personal solo me gustaron algunas canciones</span>",Positive
487,Gustavoart,"Mar 19, 2021",10,"<span>PERFEITO, SIMPLESMENTE INCRÍVEL, NADA MAIS QUE ACLAMADO, DEUS DO CÉU QUE MARAVILHA, QUE COISA LINDA, PERFEIÇÃO E POESIA EM FORMA DE MÚSICA, LANA DEL REY MANDANDO SEMPRE</span>",Positive
488,OB4CL,"Mar 19, 2021",9,"<span>Once again Lana and Jack deliver an amazing work of art, it's in the same lane as her last album 'NFR', but it's still an amazing listen!</span>",Positive
489,chemlany,"Mar 19, 2021",10,"<span>Her most cohesive album from the Honeymoon (2015) and NFR (2019) here at Chemtrails, she consolidated herself as a genius songwriter</span>",Positive
490,santicosecre,"Mar 19, 2021",10,"<span>Chemtrails feels like poetry that lovingly contemplates the nuances of life, poetry that dances over Jack Antonoff's beautiful production.</span>",Positive
491,witchwitch,"Mar 19, 2021",10,<span>Chemtrails over the country club it just the perfect continuation to NFR! Short but a consistent body of work that might be the most mature and personal album of Lana.</span>,Positive
492,lanasmycure,"Mar 19, 2021",10,"<span>amei muito a lana sempre entregando absolutamente tudo, essa mulher é minha vida.</span>",Positive
493,samvrey,"Mar 20, 2021",10,"<span>Insanely good! Lana del Rey just proved again she is the most versatile artist alive. No one is doing it like her, this album is amazing!</span>",Positive
494,Mathawsz,"Mar 19, 2021",10,"<span>Very good, simple and raw instrumentals, they bring a very clean and subtle image of this new phase of Lana Del Rey. Adequate feats and extremely accurate vocals</span>",Positive
495,hercio,"Mar 19, 2021",10,"Between whispers, she's describing the nostalgia that she's found herself submerged in. Looking back at a peaceful, but also hopeful, time, now being a name that digs deeper in these generations, Lana sings for herself too. In the Mojo interview she said she doesn't need to find a new sound, bring something that is fresh new, she only can deliver her truth, which I think is pretty honest and genuine. Some people might like it, some people don't. Lana likes it, I think that's enough for her. I lover her music so much, this is just another album I'll play every friday night.",Positive
496,Edison16,"Mar 19, 2021",10,"<span>Es un magnífico trabajo de la Neoyorquina sin dudas uno de los mejores álbumes del año, podría ser merecedor de AOTY 2022. Me encanta.</span>",Positive
497,onikadelrey87,"Mar 19, 2021",10,"<span>This is truly ba masterpiece, Lana is such a great singer. I love every song from the album it's so great.</span>",Positive
498,rikashiweyini,"Mar 19, 2021",10,"<span>O instrumental marcante que a Lana sempre mostrou em seus álbuns não poderia faltar nesse. Com composições incríveis,  Lana explorou o novo gênero musical e foi muito bem nisso. Apaixonada demais!</span>",Positive
499,gstavx,"Mar 19, 2021",10,"<span>This album is Lana Del Rey, you hear in her voice that she is happy singing these songs and that is contagious.</span>",Positive
500,SantagoDlRai,"Mar 19, 2021",10,"<span>es simplemente arte, la mejor manera de continuar la sucesión de NFR, grandioso álbum</span>",Positive
501,franmusic,"Mar 19, 2021",10,"<span>talented, brilliant, incredible, amazing, show stopping, spectacular, never the same, totally unique, completely not ever been done before, unafraid to reference or not reference, put it in a blender, **** on it, vomit on it, eat it, give birth to it.</span>",Positive
502,elizabeth02,"Mar 19, 2021",10,"cada letra de cada canción es POESÍA, es como estar en el cielo, simplemente maravilloso, te amo Lana",Positive
503,Kirillpaleco,"Mar 19, 2021",10,<span>I love this album. Lana del rey very smarty artist. Thank youuuu lana For this album</span>,Positive
504,GratefulAnxiety,"Mar 19, 2021",10,<span>This album is truly a masterpiece. From the special edition artwork to the obviously amazing songs it's all around perfection.</span>,Positive
505,jmurcia20,"Mar 19, 2021",10,"A beautiful album filled with new beats, tones, vocals and concepts to approach feelings never described and portrayed before by Lana Del Rey in such an astounding way. A true masterpiece that will surprise, entertain and seduce the listener song by song, from the first track to the last. Lana Del Rey shows her magnificent story-telling in this amazing album. Definitely, one of her best albums yet, which, to be honest, suprised me considering that NFR! could have been her peak. She continues to raise the bar for story-telling, folk and the alternative genre. Congratulations.",Positive
506,OmarReyes2526,"Mar 19, 2021",10,"<span>The album is beautiful, the lyrics are so deep and it transports you to Lana's world where she tells us everything that has happened, in the album you can appreciate the combination of such relaxing sounds.</span>",Positive
507,Simsantikk,"Mar 19, 2021",10,"<span>Amazing album! Lana is the best! Wow! 10/10. ""Tulsa Jesus Freak"", ""Chemtrails"", ""LMLYLAW"" WONDERFUL</span>",Positive
508,Theodorino,"Mar 19, 2021",10,"<span>She's done it again. Creating a masterpiece of an album, with beautiful lyrics and haunting but yet calming melodies</span>",Positive
509,Tom12,"Mar 19, 2021",10,<span>This album has the most range out of any album to date. She brings new sounds and keeps things interesting throughout the whole album.</span>,Positive
510,Lucasemanu,"Mar 19, 2021",10,"<span>Lana vem com uma proposta diferente que seu sexto álbum, Norman **** Rockwell, trás agora uma vibe mais do oeste americano onde consegue fazer com que nós possamos perceber que sua evolução vocal é perceptível.</span>",Positive
511,keviinsmiith,"Mar 19, 2021",10,"<span>Chemtrails Over the Country Club has a hint of her previous, ""NFR"" but doesn't sound too similar. A great sister album where every song sounds different but they all feel wrapped together.</span>",Positive
512,Rahul21,"Mar 19, 2021",10,<span>This album is really a work of art. She outdid herself again. Album of the year for me.</span>,Positive
513,Lindorrm,"Mar 19, 2021",10,<span>Its stunning i was wating for this album do long but its was worth tje time</span>,Positive
514,jupiter_,"Mar 19, 2021",10,"<span>AAAAA, el mejor álbum . Lana siempre logra conectar con nosotros en cada una de sus letras y hace que tengamos este tipo de sentimientos identificados, </span>",Positive
515,Depanxe,"Mar 19, 2021",10,"<span>Just the best. As ALWAYS. Soft, beautiful with deep lyrics, Unique vocals that only Lana Del Rey can do.</span>",Positive
516,notshy1312,"Mar 19, 2021",10,"<span>a breathtakingly beautiful album, and a great follow up to maybe the best Lana album.</span>",Positive
517,sotnasf13,"Mar 19, 2021",10,amazing. iconic. poetic. delicated. free emotion. album of the year. beautiful.,Positive
518,Ultravi0lence,"Mar 20, 2021",10,"<span>Talented, brilliant, incredible, amazing, show-stopping, spectacular, never the same, totally unique, completely not ever been done before, unafraid to reference or not reference, put it in a blender, **** on it, vomit on it, eat it, give birth to it</span>",Positive
519,Alejandro4,"Mar 19, 2021",10,<span>Es un álbum magnífico!<br/>Lana siempre ha sido una gran compositora ❤<br/>Espero este álbum si sea reconocido por los GRAMMYS porque ella lo merece</span>,Positive
520,adriians,"Mar 19, 2021",9,"<span>Lana's new record, in my opinion, is watered down NFR! which isn't bad. Each track is different in its own way, and still has that signature Lana + Jack sound.</span>",Positive
521,Effandy,"Mar 20, 2021",9,"<span>Another great album by Lana del Rey, from the first track 'White Dress' to last track 'For Free' love the concept and her vocal. One of the best album in 2021!</span>",Positive
522,Krishna12345,"Mar 19, 2021",10,"<span>After Nfr, it was hard to envision anyone ever being able to top it and outdo themselves. On her seventh studio album, Miss Del rey does just that!!! The production Every song is absolutely perfect and precise and Lanas natural lyricism comes to the spotlight. An easy 10/10. Love our queen mother forever.</span>",Positive
523,nikan_o_ras,"Mar 19, 2021",9,"<span>Lana Del Rey proves once again that she can't make a bad record. Each record is more unique than it's predecessor, showing her ability to take risks and always do what she likes -music wise-, never listening to the demands and the trends of the music industry.</span>",Positive
524,joadsuarez,"Mar 19, 2021",10,"If there’s one thing Lana Del Rey does, and does it really well, is putting together an album. Following her monumental 2019 Album of The Year, Norman **** Rockwell, Lana is back and she’s cooler than ever, no I mean seriously, did you hear the bridge to Dance Till We Die? exactly. Lana opens up the album with White Dress, a beautiful piano ballad filled with melancholy and nostalgic lyrics where she seems to be reminiscing on her Lizzy Grant era and her pre-fame status. The Album continues to deliver with gems, like Tulsa Jesus Freak, Dark But Just A Game, and Yosemite. She Wraps it Up with a Joni Mitchell cover to For Free, Featuring Zella Day, and Weyes Blood. Chemtrails is a short album overall, but packed with great melodies and lyricism. Lana never disappoints and she’s deserving of all accolades.",Positive
525,lucasvictor,"Mar 19, 2021",10,<span>Lana once again delivers a concept album with incredible melodies and compositions.</span>,Positive
526,Johnnata_CS,"Mar 19, 2021",10,"<span>Another amazing work by Lana. Yosemite and White Dress are both my favorites. The whole projects seems to be a future 'darling' just like Honeymoon (to me, he best record). 10/10</span>",Positive
527,pedrosmalacrida,"Mar 19, 2021",10,<span>An Amzing Folk album. Exemplar Lyrics. Lana is on her way to become a true musical legend and the best lyricist of this generation</span>,Positive
528,lflife,"Mar 19, 2021",10,<span>A breathtaking and beautiful album. Definitely one of my favorites from Lana.</span>,Positive
529,Lanadelray,"Mar 19, 2021",10,<span>Lana snapped with this omg. Her best album yet!! The production is exquisite!!</span>,Positive
530,anavabrizzi,"Mar 19, 2021",10,"<span>lana del rey como sempre mostrando ser a artista do século com suas letras impecáveis. Chemtrails é bem instrumental com um toque refinado, bem leve, sem comparação com nenhum outro.</span>",Positive
531,gui_antonucci,"Mar 19, 2021",10,"<span>Lana Del Rey once again delivered perfection, it looks like a work of God, thank you!  My favorite tracks are Tulsa Jesus Freak, Let me love you like a woman, Wild at heart and Dark but just a game, this sequence is perfect.</span>",Positive
532,Lenldr,"Mar 19, 2021",10,"<span>This album is definitely something completely different but extremely beautiful  .I admire her ability to change and grow,while remaining poetic.</span>",Positive
533,marioguida,"Mar 19, 2021",10,<span>this album is really amazing. It's a masterpiece. I think this is gonna be one of the best album that Lana del Rey have ever done. I'm going to listen to it for the next month for sure!</span>,Positive
534,isaaherondale4,"Mar 19, 2021",10,<span>This album is simply flawless! I don't have enough words to say how much I liked it.</span>,Positive
535,Alexan_Ponce2,"Mar 19, 2021",10,"<span>Definitivamente este álbum está a la par de NFR, a nivel de producción y lírica, es arte y bello. Lana superándose una vez más</span>",Positive
536,cristalized,"Mar 19, 2021",10,"A lovely album. It really got a whole different vibes and aesthetics from NFR! which was surprising. This is a same old Lana telling stories to her listeners and it delivers with a clear and raw especially in the White Dress. My favorite notable moment is the bridge she sang and the sudden switching she did in Dance till We Die. I really think this is a no skip album. My top tracks are: Dark But Just A Game, Wild At Heart, Yosemite, Dance Till We Die, and White Dress.",Positive
537,HugoVinicius,"Mar 19, 2021",10,"<span>O álbum é incrível, semelhante a andar devagar olhando para o céu, quando você sente que pertence a algum lugar, e pode ser feliz...</span>",Positive
538,Juhmp,"Mar 19, 2021",10,"<span>A wonderful album, the vocals of Lana Del Rey are impeccable. Certainly one of the best in her whole discography. Lana did the impossible, overcoming the wonderful Norman F ****** Rockwell. No words, just incredible.</span>",Positive
539,KaaHBabY,"Mar 19, 2021",10,"this is so beautiful,Lana Always serving bibles Each new album of hers always becomes my favorite, and this one was no different",Positive
540,Danielatara,"Mar 19, 2021",10,"<span>The album is full a masterpiece, the meeting of sounds, it's like a heaven. Lana travels a journey of emotions, of feelings that is not the typical story of a sad love. it is simply ideal for any moment.</span>",Positive
541,tiagomancha,"Mar 19, 2021",10,"<span>talented and incredible, what Lana do best!<br/>Maybe the best album of the career</span>",Positive
542,FrankSilva,"Mar 19, 2021",10,"<span>A cada música que começa, dá pra perceber a coesão e a ligação de todas elas, mas sem ser uma obra repetitiva. Parabéns Lana, você conseguiu mais uma vez mostrar o quão maravilhosa consegue ser nas composições, parabéns por mais uma obra de arte!</span>",Positive
543,MrDaytona,"Mar 19, 2021",10,"<span>we just entered the Chemtrails Over The Country Club era and I believe that we have just entered the life of Lana Del Rey, this Del Rey's album is a beautiful meditation on her life and fame, I really loved Chemtrails</span>",Positive
544,kdusouza,"Mar 19, 2021",10,"this album is JUST THE PERFECTION OF GODI LOVE U LANA, THANK U FOR THE CHEMTRAILS OVER THE COUNTRY CLUBE LISTEN CHEMTRAILS BY ALL STREAMS PLATAFORMS",Positive
545,JonhMunizz,"Mar 19, 2021",10,"<span>é impressionante como a Lana Del Rey consegue entregar álbuns tão perfeitos e únicos, cada musica leva você a um mundo completamente diferente e que no fim faz total sentido, é uma obra de arte pura</span>",Positive
546,lizzykillkill,"Mar 19, 2021",10,"INCREDIBLE, PERFECT AND NO DEFECTS! only words to describe this masterpiece, the lyrics, the melody. Lana Del Rey NEVER disappoint, only flawless albums in her career. GOD IS A WOMAN! GOD IS A LANA DEL REY!!!!",Positive
547,alexandre1233,"Mar 19, 2021",10,"<span>No chemtrails lana conseguiu reforçar que é eterna e que ainda tem um longo caminho pela frente dentro da industria, com um album lindo e puro, rico nos instrumentais e nos vocais</span>",Positive
548,arthurtavrs,"Mar 19, 2021",10,"<span>perfeito em tudo, um dos melhores álbum que já ouvi na vida, tenho certeza que o levarei para a vida toda.</span>",Positive
549,wiped0ut,"Mar 19, 2021",10,"<span>“chemtrails over the country club” is a dive into lana’s thoughts and feelings on her fame, unlike her previous records it feels a lot more personal and from the heart.</span>",Positive
550,Fkbo_x,"Mar 19, 2021",10,<span>Lana del Rey mais uma vez se saindo melhor do que antes!Cada letra desse álbum e cada melodia combinam perfeitamente com a genialidade da artista que é a Lana Del rey.</span>,Positive
551,1juaan1,"Mar 19, 2021",10,"<span>Muy buen álbum, es todo lo que esperaba de Lana del Rey, y mucho más.<br/>Las letras como siempre juegan una parte portante en sus canciones u eso es bueno.</span>",Positive
552,heavydirtysoull,"Mar 19, 2021",10,"Dark but just a game,wild at heart,tulsa jesus freak,white dress—it’s all just perfect songs. This album deserves the world,i’m in love",Positive
553,gardsss,"Mar 19, 2021",10,"love this album, lana del rey is inteligent and beautiful woman in world of music",Positive
554,ScottScottov,"Mar 19, 2021",10,"<span>By far the best Lana album, wonderful folk. Tulsa Jesus Freak is the diamond of the entire album. Listen and enjoy.</span>",Positive
555,vladislove1,"Mar 19, 2021",10,This Album so Amazing so soft and sweet Этот альбом покорил мое сердце Ланочки большая молодец,Positive
556,flrnls,"Mar 19, 2021",10,Это прекрасно! мне очень понравилось!!! королева вернулась и унизила бибера!!! кто поставит ноль будет гнить в аду,Positive
557,jessiepark,"Mar 19, 2021",10,"<span>Love this album so much. So nostalgia evoking, makes you feel like you traveling through the past, looking at the old and painfully familiar places with a different view. It's like a beautiful story told by a campfire. It's like an ode to all those friends and loved ones you used to have and still have.</span>",Positive
558,Banigi,"Mar 19, 2021",10,"<span>Lana or Lizzy Grant? Mayde its mix, but i like is. Thank you lana for this album</span>",Positive
559,averingrisha,"Mar 19, 2021",10,Lana has grown into a real artist who wants to tell her fans her story of becoming what she is now. thank you to her for this universal love,Positive
560,alexanderVII,"Mar 19, 2021",10,<span>I think Lana is getting better every time she releases an album. This is one of the best she has.</span>,Positive
