,name,date,rating,review,critic
683,carolinda,"Mar 19, 2021",10,"<span>coesão, aclamação, senti a presença de deus logo na primeira música, lana lenda só serve coisa boa</span>",Positive
684,Cosmicnauta,"Mar 19, 2021",10,AmoooooooooooooooooooooooooooooooooooooooOooooooooooooooooooooooooooooooooooooooooooooooooooooooooooooooooooooooo,Positive
685,lucas121212,"Mar 19, 2021",10,"so good, and perfect hdhsksjfkdjnsnanxkskskfkwkdkskkaksksmdnskamxmskzkskksskmwmdksaoxkksskksjdkadjjsksjfkwdkjsannfdmndfnnslslwkxjksj vc wkkwktjnwmsndbxnajskwkdknewkdjkskskskwhdusisjfwkkdjfjskdkfmekekdkdnsneiwidjdjskdksndnwoskksjdjdjwkefokwdjsjwoei lana is perfect bakejekakdjwjeekkskdjwkskskskelana de rey linda te amokajrjskakekwksksksks kakajsjsjdjsjskskskwowkdjwjwkskdkskkdjfdjkskskskskskskakajsjdjdjdjdjskekwkkdjejedjaosklslaqlwlelwkwkeekeiiwiwoeieek mto holmmmmwjjeejrjwoeoowowdkkxkxjxkkKzkkzkdkeowososokdjcskkszkj jxkc",Positive
686,Drewa_lipa,"Mar 19, 2021",10,<span>Lana delivers yet another well thought out piece of genius that challenges and bucks today’s music landscape.</span>,Positive
687,Guillermxhr,"Mar 19, 2021",10,"<span>Its amazing how Lana change in this year, its just an amazing album 10/10, 0 skips every song is amazing and gorgeous.</span>",Positive
688,TheRealCritic10,"Mar 19, 2021",10,<span>This album is amazing </span>,Positive
689,ironely,"Mar 19, 2021",10,"<span>As for now ""Dark But Just a Game"" is my favorite from this album along with Wild At Heart. I thought this album wouldn't be that good as NFR is a hard one to top. Lana is one of the best songwritters of this decade.</span>",Positive
690,lanachemtrails,"Mar 19, 2021",10,"<span>simplesmente perfeito! em COTCC, Lana Del Rey volta a provar todo seu talento e mostra ao mundo para o que veio. ""dark but just a game"", é uma das faixas que se destacam. sua leveza e simplicidade encantam que a ouve.<br/>e sirva o grammy bem gelado!</span>",Positive
691,shuaijing,"Mar 19, 2021",10,<span>This album is more personal than others.  Lana shows us a secret life which leads to her mood.</span>,Positive
692,Scheila505,"Mar 19, 2021",10,<span>all the tracks are perfect and I'm in love with Dark But Just A Game.  album of the year?  sure yes!</span>,Positive
693,Gustafrockwell,"Mar 19, 2021",10,<span>Lana did it again! Such a perfect album with great vibe and stunning lyrics!</span>,Positive
694,Juandavid12,"Mar 19, 2021",10,"<span>The album is full of beautiful melodies, besides that the change between songs feels like a story, in which all listeners feel involved, and we can even feel in common with the lyrics that are too good and without any explicit.</span>",Positive
695,felifernandez,"Mar 19, 2021",10,"<span>te amo Lana Del Rey sos lo mejor que me pasó en la vida, me alegraste la noche de una manera gigante. el album no tiene skips es lo mejor que me pasó en el año DARK BUT JUST A GAME SOTY</span>",Positive
696,willemragnar,"Mar 19, 2021",10,"<span>Magical melody and amazing lyrics. Anyone who dislikes this album is stuck in the past and is unable to move on. Lana is so much more than Ultraviolence. I though NFR was the best she could do, but she really outdid herself with COCC</span>",Positive
697,merna12,"Mar 19, 2021",10,This album is unique in its sound and different from anything Lana has ever done. She speaks on the idea of leaving behind LA and all its fame. She flirts with the idea of leaving behind the fame; even admitting she’d be better off in a simple life as she recalls her early life in the album opener “White Dress”. This production is beautiful and done well by Jack Antonoff. The best is yet to come. Lana has done it again. 10/10,Positive
698,luccajerep,"Mar 19, 2021",10,"<span>This album is impecable, I'm literally obssesed. Thank you, mother Lana! AOTY 2022</span>",Positive
699,shaunpowell108,"Mar 19, 2021",10,"<span>Lana continues her mesmerising sound from NFR with a beautiful follow up album. White Dress and Wild at Heart are standouts, but there is no low point on a record this good.</span>",Positive
700,vladmishkin,"Mar 19, 2021",10,<span>королева в очередной раз создала вселенную</span>,Positive
701,Enriqueroman_,"Mar 19, 2021",10,Siempre con su esencia!! Hermoso album! Ella tiene una gran capacidad para contar historias a través de su música,Positive
702,Kaveen,"Mar 19, 2021",10,"<span>I don't know how Lana Del Rey managed to top Norman F Rockwell but she did it ! This album is beautifully crafted and the lyricism is impeccable. Telsa Jesus Freak and White Dress are the standout tracks in my opinion. the only bad side of this masterpiece is it's length, it is way too short hoping for a Deluxe version soon.</span>",Positive
705,christopherherr,"Mar 19, 2021",10,"Hermoso álbum, lana sigue presenté demostrando los sentimiento a flor de piel. Cautivando con la lírica y sonidos que la caracterizan",Positive
706,ramirocastro_,"Mar 19, 2021",10,"It’s one of her most mature works. Having done one of the best albums of 2019, “Norman Fu***** Rockwell!”, Del Rey goes back to her folk beginnings and gives us a beautiful work in which she mixes the former sounds with a delightful and moving lyric: nostalgia, wildness and personal freedom are some of its topics. In addition, she takes inspiration from singers such as Fiona Apple in “Dance Till We Die”. Moreover, she produced a beautiful collaboration with singers Zella Day and Weyes Blood (“For Free”) apart from having invited Nikki Lane to sing “Breaking Up Slowly”. The collaborators’ voices just cope with Lana’s voice perfectly.All in all, in terms of lyricism and production, it’s a marvellous long production – Del Rey found out the way to make one of the best albums of 2021 yet.",Positive
707,bluesparkler,"Mar 19, 2021",10,<span>Probably Lana’s best album in her whole career. Chemtrails Over The Country Club is just a cultural reset... Best track is Tulsa Jesus Freak</span>,Positive
708,ThiagoRangel,"Mar 19, 2021",10,"The ""Chemtrails Over The Country Club"" is like a passage about modern culture, about being free to be wild and vulnerable, it is about remembering good times, and like a cry in the dark, it needs to be heard and it wants to be heard. Lana Del Rey returns to her origins as Lizzy Grant (May Jailer), embodying the folk genre of her first musical project ""Sirens"" on this album.  Yosemite is one of the great highlights of the album, when she starts singing about the seasons in a poetic way, a flash back in our heads, the music and about comfort and how good it is to have a comfortable, safe, free, free love, funny. Chemtrails Over The Country Club is one of the highlights of this year, with it Elizabeth Woolridge Grant proves that she is not only the queen of New York but the queen of the world.",Positive
709,Andrecardosobm,"Mar 19, 2021",10,"<span>Pure perfection, problably my new favorite album of hers, loved every song and it's a no skip for me</span>",Positive
710,aoife1881,"Mar 19, 2021",10,"<span>A masterpiece throughout from start to finish, between the flow from one song to the next to the gorgeous lyrics. A true sense of Lizzy Grant finding her inner self, and we’re right there with her. Beautiful album nothing less of 10/10</span>",Positive
711,claytonn,"Mar 19, 2021",10,"absolutely stunning, queen mother never disappoints. once again another masterpiece that’s quite impossible to rank",Positive
712,pedro_wildere,"Mar 19, 2021",10,"<span>é uma obra de arte, um álbum único e excepcional! somente lana del rey possui essa sensibilidade de produzir um álbum neste patamar.</span>",Positive
713,euigorluz,"Mar 19, 2021",10,"<span>Épico, magnífico. Escândalo. Esse álbum beira a perfeição do seu antecessor, Norman Rockwell. Com melodias folk, country e indie pop, Lana trouxe mais um excelente trabalho e um doa melhores álbuns albuns da década. Digo com clareza: Album do ano!</span>",Positive
714,NicolasAguiar,"Mar 19, 2021",10,<span>E vamos de AOTY!!!!!;<br/>NFR que lute como melhor Álbum da Lana<br/>Lana sempre Cirúrgica com suas letras!!</span>,Positive
715,jago2004,"Mar 19, 2021",10,"<span>Her best album yet lyrically, you can really see how she has matured, all while exploring many different vocal styles. I love it</span>",Positive
716,alessio171,"Mar 19, 2021",10,"<span>outstanding record!! Lana Del Rey keep evolving like an artist and like a person. She shows us her evolution though this dreamy folk record. She shows us that she is one of the legend that she quote through her songwriting. The first record that she created with Jack tell us the story of the coast and her LA, with Chemtrails she tells us the story of the deep land that she loves!.</span>",Positive
717,nazik_tsikalo,"Mar 19, 2021",10,<span>Amazing piece of art where Lana reminisces her past days of being Lizzy Grant. Solid album structure with gorgeous production</span>,Positive
718,elion,"Mar 19, 2021",10,<span>Maravilhoso! Não tenho nem palavras para descrever como esse novo álbum da Lana caiu como uma luva! Composições maduras e melodia que flerta com o folk. Não poderia estar mais satisfeito!</span>,Positive
719,ultramilito,"Mar 19, 2021",10,"<span>Te amo tanto Lana Del Rey me cambiaste la vida sos lo mejor que me paso, mi vieja me dio la vida pero vos ganas de vivirla<br/>Tulsa Jesus Freak soty 2021 no me importa nada</span>",Positive
720,bycinnamongirl,"Mar 19, 2021",10,"One of Lana Del Rey's best albums, it has never been done before. A mix between 'Norman **** Rockwell', 'Lust For Life' and 'Honeymoon', also a little bit of her Lizzy Grant era. 'Chemtrials Over The Country Club' talks about her life experiences, her youth and her feelings in a way you can totally reflect yourself. The music is just great, a rollercoaster of feelings produced by Jack Antonoff, and the lyrics composed by our beloved Lana Del Rey. I highly recommend this masterpiece, listen to it as soon as possible.",Positive
721,fabioalvaro,"Mar 19, 2021",10,<span>its from other place. i love how lana grows up in every new album. i really love it</span>,Positive
722,ccamspinelli,"Mar 19, 2021",10,<span>lana del rey supremacy!    .</span>,Positive
723,vitriolCossu,"Mar 20, 2021",10,"<span>Este álbum es una obra maestra, hay todo de Lana, su fuerte personalidad, su estética pero también algo nuevo y más íntimo, qué nunca nos había revelado - quizás sea también el último trabajo de la artista con su pseudónimo, sería una despedida perfecta de un ""personaje"" que nos lo ha dado todo y que ahora tiene que renacer como Persona. Ahora queremos Lizzie</span>",Positive
724,mouadd,"Mar 19, 2021",10,"<span>Del Rey’s new album took a Folky shift, and she did not fail. Her 7th studio album Chemtrails Over The Country Club unveils her true artistry, and a mix of her old and new self. She truly is the best lyricist of this generation and this album is truly the Next Best American record.</span>",Positive
725,Joaocv,"Mar 19, 2021",10,"<span>Lana es fabulosa, este álbum hizo que me enamorara de ella y me provocó escuchar sus demás álbumes, realmente ella tiene todo lo necesario para hacer que la gente cambie de opinión al escuchar su música.</span>",Positive
726,isavzds,"Mar 19, 2021",10,"<span>esses pianos a voz mudando de tom o tempo todo o ritmo da música mudando, isso me faz pensar em janis joplin um folk 70s. um ótimo album.</span>",Positive
727,COCCstan,"Mar 19, 2021",10,"<span>This album is really good, all of the songs are good, lana had her peak with norman **** rockell but with this album she shows that she can do better and better, we stan a talented queen</span>",Positive
728,belair23,"Mar 19, 2021",10,<span>**** **** the **** album! Dope!<br/>Her career picked up this spot.<br/>Her smooth voice and strong words..</span>,Positive
730,lanatorta,"Mar 19, 2021",10,"<span>Muy buen album sobre todo la parte desde que empieza hasta que termina, sin duda lo recomiendo. Wild At Heart mi canción</span>",Positive
731,Dingiz,"Mar 19, 2021",10,This album hits different ,Positive
732,karen_direction,"Mar 19, 2021",10,"<span>Monumental album, it’s so pure and angelical, I really love this, the lyrics are amazing, I love Lana and Jack, thanks to the both of you, one of the greatest albums Lana has ever made.</span>",Positive
733,ximena_delrey,"Mar 19, 2021",10,"<span>•READY! I finished listening to the album and give it a rating of 10/10, a masterpiece as always, Lana Del Rey got involved with beautiful Folk sounds, melancholy tones and beautiful lyrics, an album that left me speechless as always </span>",Positive
734,solcostela,"Mar 19, 2021",10,"<span>After such a good job (Norman F Rockwell) it is very difficult to maintain the level and even exceed it, but Lana Del Rey always knows how to succeed and present an album of magnificent quality, she really sets her expectations very high and fulfills them. Excellent work by the artist as well as Jack Antonoff's, this duo never disappoints. congratulations Lana.</span>",Positive
735,maludelrey,"Mar 19, 2021",10,"<span>lana is always right! the best album of the year, **** I really loved it and I love lana. Her lyrics, her melody, everything about her is amazing. I'm proud of lana</span>",Positive
736,Nicole2445,"Mar 19, 2021",10,"<span>Chemstrails Over the Country Club  is masterpiece, it deserves all the recognition in the world, every time Lana del Rey is growing as a person, and that is incredible. I love this album too much!!</span>",Positive
737,Eridany,"Mar 19, 2021",10,Es perfecta en todos los sentidos ,Positive
738,lustforlanac,"Mar 19, 2021",10,"<span>such a personal album! beautiful vocals, nice composition, she literally saved this year with this album!</span>",Positive
740,Tulsajesus,"Mar 19, 2021",10,"<span>Te amo lana, el album es una masterpiece igual que vos, gracias por existir AOTY 2021 100/100</span>",Positive
741,Camilo_cond,"Mar 19, 2021",10,"Un grandioso álbum, llenos de diferentes matices, una gran lírica, lleno de muchos instrumentos grandiosamente logrados, un gran rango vocal y una gran temática.",Positive
742,rfqhzhdh,"Mar 19, 2021",10,"<span>waited 6 months after she announced that the album got delayed, worth the wait and i love it </span>",Positive
743,cool_skyangel,"Mar 19, 2021",10,"<span>This is an album that touch your heart. A place you don't wanna leave. A pat to the soul. Pure art. Magnificently written, beautifully singing. Sa usual Lana del Rey never disappoints.</span>",Positive
744,TheMusicExpert,"Mar 19, 2021",10,"Chemtrails cannot feel like a subtle but at a different point continuation of its predecessor `Norman Fkn Rockwell´ (2019), its most acclaimed album to date and it shows when listening to the first song ´White Dress´, the which goes to demonstrate another type of vocal use of Lana that we had not heard completely in her previous discography. Regarding the 11 songs on the album, we must also highlight the beautiful arrangement of the song ´Wild Heart´, in it the voices and harmonies evoke a more mature and confident Lana in her style. In addition, another of the surprises that this album gave me was the interesting production of the song ´Dark But Just a Game´ in which for seconds we are facing a well-achieved attempt of alternative Folk combined with a progressive R&B, to then start with a vocal clarity and Beattles-style production, a tonality never seen before with Lana and that is appreciated. I have always liked being very objective with this artist, when I don't like a Lana's album, I comment on it. However, in this album Lana demonstrates once again that her melodies, lyrics and style is unique and different from everything that is in the music industry today in a mature, bold and beautiful way. My Favorites: Dark But Just a Game, Yosemite, Dance Till We Die, Wild a Heart, White Dress. My least favorites: Let Me Love You Like a Women.",Positive
745,albertthen,"Mar 19, 2021",10,"<span>This album sounds lots like her Unreleased era and that's just perfect because it's like she came back to her roots, her Lizzy Grant era. Very cool bloody lovely rly.</span>",Positive
746,jullan,"Mar 19, 2021",10,"<span>Absolutely incredible, beautiful melodies, thoughtful lyrics all paired with Lanas beautiful voice!! 10/10!!</span>",Positive
747,ABRAXAS61627,"Mar 19, 2021",10,"<span>Es increíble como Lana del Rey ha sabido mantener sus trabajos tan pulido a través de los años sin caer en lo redundante y vacío. Este álbum bien podría ser el hermano perdido de su anterior álbum, pero con el espíritu de una persona de los 70's y con una instrumental muy bien cuidada.</span>",Positive
748,JairCerritos,"Mar 19, 2021",10,"<span>El álbum es una maravilla. El instrumental, las letras de las canciones, la voz de Lana del Rey es hermosa. 100% recomendable</span>",Positive
749,Erdenay,"Mar 19, 2021",10,<span>Perfect </span>,Positive
750,lizca,"Mar 19, 2021",10,"<span>The album has a soft rock / jazz / folk sound. And I loved it! For me, this style was totally unexpected. The album has only 3 composers, which is amazing, since the lyrics are beautiful and touch you deeply. Lana Del Rey is talented. Lana Del Rey is artist!</span>",Positive
751,chemtrayls,"Mar 19, 2021",10,"<span>An amazing experience featuring astonishing instrumentals and stunning bridges, features.</span>",Positive
752,Kat567,"Mar 19, 2021",10,"Beautifully done! It’s the old money aesthetic of the songs and album as a whole that makes a place like Nantucket come to mind. Just bright summer days with picnics in the grass, and quiet summer nights by a bonfire on the beach. I will always be nostalgic for Lana’s previous albums since I listened to them as a teenager, but this new sound is the start of something great. White Dress, Chemtrails Over the Country Club, Dark But Just a Game, and Not All Who Wander Are Lost are stellar tracks. So much of today’s music that is popular is louder and fast paced, and may deter some from giving this a listen because it isn’t exciting or danceable enough. However I hope that people, even Lana fans who love her old music more, give this a good listen more than once. There’s so much to appreciate from it, and I hope to see more music videos as a visual aide to this wonderful new sound of hers.",Positive
753,Peter76,"Mar 19, 2021",10,<span>The lyrics of this album are amazing and all of the songs are well composed. I love that Lana always experiments something new in every album.</span>,Positive
754,Alwaysupatnight,"Mar 19, 2021",10,<span>Beautiful... Lana has showed sides of herself we’ve never seen before. She can do no wrong.</span>,Positive
755,TONYSW13,"Mar 19, 2021",10,"<span>The intelligent way that it has to be a minimalist album and powerful in lyrics, with touches from her entire discography and the melodic voice of lana makes the album very good, it maintains its style but continues to surpass itself on an artistic level.</span>",Positive
756,Halli,"Mar 19, 2021",10,"Simplemente espectacular, es un álbum que contiene mucho sentimiento, y es algo distinto a lo que Lana viene realizando, y me encantó que tenga unos toques de canciones pasadas, cada vez me sorprende más...ICONIC",Positive
757,debbymokke,"Mar 19, 2021",10,"<span>ARTE, GRACIAS POR TANTO DIOSITO DEL REY. </span>",Positive
758,outdat3dd,"Mar 19, 2021",10,<span>show stopping amazing spectacular left me speechless made me so happy for her on how much she’s grown</span>,Positive
759,drugxst0rexcand,"Mar 19, 2021",10,"This is the best album that Lana put out after NFR I love it I love it and without a doubt it is the best, Lana the best composer",Positive
760,shc,"Mar 19, 2021",10,"<span>Posiblemente el mejor trabajo de Lana del Rey. Tal y como ella ya había mencionado, tiene muchos toques de NFR, es su ""hermano"". Pero aún así logra tener su propio estilo, con canciones como ""White dress"" y ""Tulsa Jesus Freak"" es único y hermoso.</span>",Positive
761,Rafa06,"Mar 19, 2021",10,<span>Sinceramente Lana ha mostrado una evolución increíble en estos últimos dos álbumes. Chemtrails over the country club es tan hermoso con unas melodías originales y con una lírica poética  . Es un álbum que te motiva a ser libre . White dress y Yossemite son las canciones más u que jamás haya escuchado antes</span>,Positive
762,rasecdelrey,"Mar 19, 2021",10,"<span>El mejor álbum que he escuchado en toda mi vida, gracias Lana por compartir tu arte con toda la humanidad, 10/10</span>",Positive
763,Hannahbbb,"Mar 19, 2021",10,<span>Great album very soothing beautiful vocals . Clean work as always expected from lana del rey</span>,Positive
764,samdollimore,"Mar 19, 2021",10,<span>she really served with this. there’s not a single skip. each song is just beautiful.</span>,Positive
765,mariocazarin,"Mar 19, 2021",10,so **** great. Jack Antonoff & Lana Del Rey make magic together. The Lyrics and Acoustic in this album is over the top and we love the collaborations that make justice for the past ones,Positive
766,Arantza45,"Mar 19, 2021",10,"<span>Está increíble, las letras, las melodías todo es un álbum hermosooooo, en verdad que Lana del Rey cada ves me sorprende y enamora más, este álbum a sido una de mis favoritos</span>",Positive
767,vb37,"Mar 19, 2021",10,<span>Really amazing! Liked every song on this album. It's so different from NFR!</span>,Positive
768,Estipvalencia,"Mar 19, 2021",10,"<span>Es hermoso el álbum, la voz de lana se hace notar más que sus anteriores álbumes, escuchar cada canción es entrar a otro mundo</span>",Positive
770,victoracostaj,"Mar 19, 2021",10,"<span>Good album with a lot of different songs. the lyrics are poetic as one would expect from Lana,We did it fot the right reasons.</span>",Positive
771,rickdelreyy,"Mar 19, 2021",10,<span>beautiful talented nostalgic magnificent amazing show stopping spectacular breathtaking</span>,Positive
772,msommer43,"Mar 19, 2021",10,<span>Amazing!!!!!!!!!!!!!!!!!!!!!!!!!!!!!!!!!!!!!!!!!!!!!!!!!!!!!!!!!!!!!!!!!!!!!!!!!!!!!!!!!!!!!!!!!!!!!!!!!!!!!!!!!!!!!!!!!!!!!!!!!!!!!!!!!!!!!!!!!!!!!!</span>,Positive
773,dianasalinas,"Mar 19, 2021",10,<span>this album is just so perfect that words are not enough to explain it. just melancholic af. some of her best projects</span>,Positive
774,Juanviramonttes,"Mar 19, 2021",10,"<span>Lana del rey is One of the most talented persons around the World. This album is a masterpiece, touch our hearts and also this lyrics. 10/10</span>",Positive
775,lluciano,"Mar 19, 2021",10,"Lana Del Rey entrega aos seus fãs e ao mundo inteiro um álbum novo com grande excelência! Antes se tinha dúvidas sobre o que estava por vir após o clássico ""NFR!', e ""aí veio ""Chemtrails Over The Country Club"", mostrando a evolução da cantora e de seus vocais, fazendo algo novo e encaminhando para algo maior ainda.Top 5 melhores: Yosemite; Not All Who Wander Are Lost; Dark But Just A Game; Tulsa Jesus Freak e Breaking Up Slowly.",Positive
776,JeanPierreAlves,"Mar 19, 2021",10,"Após o lançamento do Norman **** Rockwell!, ápice lírico e sonoro de Lana Del Rey, era difícil definir qual a expectativa que se tinha acerca do seu sucessor. A verdade é que Chemtrails Over The Country Club veio melhor do que a encomenda. Se NFR entregou coesão em uma experiência mais imersiva, seu irmão mais novo é mais contido e diverso, beirando o experimental, mas não deixando de entregar a qualidade que é característica da artista desde os seus primeiros trabalhos. Musicalmente, hoje, nenhum outro artista em evidência soa parecido à Lana Del Rey, apesar da influência da artista em variados gêneros, principalmente o pop. Taylor Swift, em 2019, foi cirúrgica ao dizer que Lana foi a artista que mais influenciou a música pop da década de 2010. E isso não muda agora. Ao explorar sonoridades diversas, passeando por batidas de jazz e acordes de country, Lana mostra mais uma vez os caminhos possíveis. O piano de White Dress combinado com a voz sussurrada que relembra os dias antes da fama entrega uma abertura tão memorável quanto a de Norman **** Rockwell. Tulsa Jesus Freak e Dark But Just A Game trazem elementos rítmicos modernos, enquanto Yosemite é um clássico acústico de Lana Del Rey. Chemtrails Over The Country Club é provavelmente um pouco mais triste e melancólico do que foi NFR, e faixas como Breaking Up Slowly são a prova disso, mas a grata surpresa da segunda parte de Dance Till We Die quebra essa atmosfera por alguns instantes, e não de uma forma negativa. Da mesma forma, a melancolia evolui para o épico na icônica Wild At Heart, uma faixa que poderia estar em qualquer outro disco da artista, mas escolheu este como abrigo e agrega muito ao conjunto. Dentre tantos acertos, a música que dá nome ao álbum, Chemtrails Over The Country Club é a faixa mais autêntica de todas, e após a gran apertura de White Dress, dá o tom para o que está por vir. É difícil superar o que Norman **** Rocwell! fez em 2019, mas aqui não há essa intenção. Há a clareza de que se é o sucessor do mesmo, e para dar certo, teria de ser diferente. Chemtrails Over The Country Club é perfeitamente diferente de seu antecessor, e nos deixa curiosos pelo que Lana Del Rey ainda poderá fazer na longa trajetória artística que tem pela frente.",Positive
777,ljmusic,"Mar 20, 2021",10,"<span>This album is amazing. The vocals, the lyrics and even the production is all superb. I am so proud of her.</span>",Positive
778,Aldo25,"Mar 19, 2021",10,"<span>Este álbum es increíble, los sonidos dan mucha paz, innovando con sonidos country. Además los vocales son maravillosos, una obra de arte.</span>",Positive
