,name,date,rating,review,critic
238,fixer_1692,"Mar 19, 2021",10,"<span>Its AMAZING!!! This songs have a folk vibes, her Sweet voice remember this beautiful days when the pandemic isn’t between us. This is a perfect continue to NFR!</span>",Positive
239,Klim6555927,"Mar 19, 2021",10,"<span>With each album Lana grows more and more as a songwriter, as a performer and as a person. Del Rey has 100% cemented her name in music and is now definitely in the lead. Great</span>",Positive
240,Dani99,"Mar 19, 2021",10,<span>Mesmerizing</span>,Positive
241,nataliarg,"Mar 19, 2021",10,"<span>Just art, Lana es cultura, disfruté completamente cada canción de esta obra de arte</span>",Positive
242,nicholassguerra,"Mar 19, 2021",10,"<span>Uma verdadeira obra de arte, assim como o Norman **** Rockwell.. O álbum do ano está pronto</span>",Positive
243,MagnoPaz,"Mar 19, 2021",10,<span>Perfect and beautiful album!  Lana sempre surpreendendo em mais um trabalho diferente dos anteriores mas sempre marcado com sua essência.</span>,Positive
244,Damq,"Mar 19, 2021",10,"<span>A great growth in the voice, the lyrics as poetry they make , that make one identify with the music. The instrumentals are so clean that listening to the entire album creates peace.</span>",Positive
245,EmanuelAndres,"Mar 19, 2021",10,"<span>Una clara diferencia de su anterior album,  uno de los mejores álbumes en lo que va del año uwu</span>",Positive
246,ibrunolima,"Mar 19, 2021",10,<span>It is a wonderful album.  No defects. Del Rey once again does not disappoint in bringing something with extreme quality.</span>,Positive
247,diegosantos_01,"Mar 19, 2021",10,"<span>A masterpiece! One more time Lana Del Rey proved to everyone that she is in another landing, and everything she does it's perfect.<br/>Chemtrails Over The County Club is an amazing album with news sounds explored by Del Rey and make us feel like home with all nostalgia of your two first álbuns: Sirens and Lizzy Grant.<br/>It's a really traveling between happiness and a conception of life.</span>",Positive
248,Tanorgutierrez,"Mar 19, 2021",10,"<span>just beautifully written, magnificent lyrics and one of the best voices you could ever hear. no comparissons. just some of her best projects. as usual always giving her best</span>",Positive
249,Billygigoza,"Mar 19, 2021",10,"<span>Talented, brilliant, incredible, amazing, show-stopping, spectacular, never the same, totally unique, completely not ever been done before, unafraid to reference or not reference, put it in a blender, **** on it, vomit on it, eat it, give birth to it.</span>",Positive
250,sergiocamargo,"Mar 19, 2021",10,<span>she really ate with this album. she has definitely found a sound that fits her well.</span>,Positive
251,jomathsm,"Mar 19, 2021",10,"<span>An amazing album!! Love Lana so much, she's my queen and rules the whole world!!</span>",Positive
252,abys,"Mar 19, 2021",10,"<span>Совершенно необычная работа, не похожая на то, что она делала раньше, хотя многие его соотносят с nfr. Изумительный альбом</span>",Positive
253,SoniaRey,"Mar 20, 2021",10,<span>Very authentic and cool. One of the coolest Lana’s albums. ❤️❤️❤️❤️❤️❤️❤️❤️❤️</span>,Positive
254,Vitir,"Mar 19, 2021",10,"<span>Lana del Rey soube trabalhar voz e harmonia nesse álbum, as letras são verdadeiras poesias. Era esperado que algo tão grandioso viesse dela!</span>",Positive
255,Bousamra3,"Mar 19, 2021",10,<span>A fckn masterpiece!!!! Lana Del Rey does it again! #StreamChemtrailsOverTheCountryClub</span>,Positive
256,wildelrey,"Mar 19, 2021",10,<span>outra obra prima da melhor escritora norte-americana Lana Del Rey. trazendo um álbum orgânico e puro. obrigado Deus por nos abençoar</span>,Positive
257,Acru,"Mar 19, 2021",10,"<span>A beautiful follow up to NFR, subtle and simple, feels like she’s taking a journey from California to the midwest, and the Joni Mitchell cover is perfect to end  it and summarize Lana’s fascination with freedom and the wonderful people around her. 10/10.</span>",Positive
258,Larissabsn,"Mar 19, 2021",10,"<span>this is amazing, fabulous and incredible! Com certeza um dos melhores álbuns já produzidos no milênio.</span>",Positive
259,davizsad,"Mar 19, 2021",10,<span>AOTY! Quando o assunto é ser a RAINHA do alternativo ninguém bate de frente com a lenda</span>,Positive
260,EzequielHe,"Mar 19, 2021",10,<span>As always Lana is giving something great as only she can do. Perfect bit and lirycly impecable.</span>,Positive
261,Desknor,"Mar 19, 2021",10,<span>The B-side to NFR. This album is showing all of us where Lana Del Rey is heading and it's a magical fun joyride to the final destination!</span>,Positive
262,GOODMEAL,"Mar 19, 2021",10,"<span>Lana's follow up to Norman F******* Rockwell! is absolutely stunning. Her songwriting here is flawless, and she carries you along with her silky smooth voice. Jack's production is stripped back and always Lana to shine. It deserves its perfect scores!</span>",Positive
263,zakjoao,"Mar 19, 2021",10,"<span>Once again she comes with all her glory into another introspective look about the America she grown e dreamed of. And leave a message for who are concerned about the charts she never cared: “The cameras has flashes, they causa the cars crashes, but I’m not a star”</span>",Positive
264,Pedro97,"Mar 19, 2021",10,"<span>Álbum bem construindo e sintonizado ao que se propôs ser, essência de Lana Del Rey em seu mais puro sentimento.</span>",Positive
265,ondxrection,"Mar 20, 2021",10,<span>e mais uma vez a Lana Del Rey faz tudo do bom e do melhor. ser fã dessa mulher é incrível. talento puro</span>,Positive
266,Futureebound,"Mar 19, 2021",10,<span>I just love everything this woman does.. she's a real poet.. Great great great album ❤️❤️</span>,Positive
267,angietw,"Mar 19, 2021",10,<span>Great lyrics and instrumentals. This is masterpiece! I love Not All Who Wander Are Lost</span>,Positive
268,MusicFame,"Mar 19, 2021",10,"This is a bible, you have amazing vocal notes, lana you deserve everything.",Positive
269,sergioyisus,"Mar 19, 2021",10,"Chemtrails Over The Country Club sigue el patrón usado en la producción de Norman **** Rockwell. En cada producción se ve el desapego de Lana por ir a lo comercial y es así como labra su camino a ser una de las mejores compositoras de nuestros tiempos, leyenda, icono y dejar un legado para las generaciones futuras. De por si, sentó las bases de lo que es la música pop al día de hoy, sin promoción alguna, su nombre tiene un gran peso.",Positive
270,N1e3nn5a7,"Mar 19, 2021",10,"Definitely going to be one of the biggest favorites this year. Lana as always shows her exceptional charm and in some way she even goes back to the basics with all the guitar sounds and singing about being a waitress. The instrumentals are crazy, someone may think they’re even too much, but I think it’s a perfect balance between her angelic voice, soft piano sounds and interesting guitar samples. Pretty sure not everyone is going to like it, but I enjoyed it, every single song of it.",Positive
271,Victorgot18,"Mar 19, 2021",10,<span>A pure masterpiece! Lana Del Rey never misses! The way she puts her soul into the music is amazing.</span>,Positive
272,Violet_Pill,"Mar 19, 2021",10,"It’s such a surreal feeling when you’re finally able to listen to the music  you’ve been waiting for so long. When you look at the names of the songs and you already know that they’ll have a special place in your heart. And one day these songs will remind you of days when they came out...The album gives me that warm country/folk vibe. It’s like we’re sitting in the bar with old friends and Lana is singing just for us, just for her friends. And during this era we see so many people around her - family and friends (just look at the album cover)!!! So beautiful and cozy! And it makes me feel like I’m a part of it (and here you might think I’m crazy and yes I actually am haha). I feel the connection to Lana and her emotions and feeling. We’re closer than ever. I love every single song: Tulsa Jesus Freak - I’m in love with this song! White hot forever! It was supposed to be the name of this album if you remember it:) White dress - so nostalgic and beautiful(especially the vocal), I can’t wait to see the video. It’s going to be amazing! Wild at heart - it reminds me of Mariners Apartment Complex - magic! Not all who are wander are lost - wow it’s like something from Ultraviolence but with a flavour of COTCC. Yosemite - it’s like a movie soundtrack. Dance till we die !!! What? Have you heard that amazing bridge? Aaaahhh I’m so impressed by the Chemtrails and the lead song is fantastic so is the video, I can’t stop listening to it. Thank you, Lana, for everything you’ve done! I love you and your music, and your poetry so much.",Positive
273,Venice_bih,"Mar 19, 2021",10,"<span>Beautiful, gorgeous, marvellous, breathtaking, charming, magnificent. AOTY is coming!!!</span>",Positive
274,Lanasbeech,"Mar 19, 2021",10,"<span>perfect album. perfect lyricism, such an experimental and jazzy, soft rock-y feel. beautiful melodies and lyrics. Lana's absolutely served AGAIN</span>",Positive
275,weszcs,"Mar 20, 2021",10,<span>lana del rey being amazing on yet another album ... a mixture of sadness and happiness sounds impeccable</span>,Positive
276,Sekretmoon,"Mar 20, 2021",10,"<span>I love this album, I feel like Lana enjoyed recording each of the songs.<br/>In this album she experiments a lot with her voice, it is something different from all her previous works, without a doubt an album that anyone will enjoy.</span>",Positive
277,matthewsmith236,"Mar 19, 2021",10,"<span>Some of her best work! My favorite songs are Wild At Heart, Dark But Just A Game, and Not All Who Wander Are Lost. Definitely recommend to all Lana fans!</span>",Positive
278,StevenMMS,"Mar 19, 2021",10,"<span>Just as NFR, is an incredible album, simply beautiful. Lana did a great job with this one. Delicate vocals, instrumentals and production.</span>",Positive
279,P0shya,"Mar 19, 2021",10,"Another beautiful masterpiece from our great and inimitable Lana Del Rey. The album is listened to in one breath, these incredible melodies and these incredible lyrics drive you crazy on the universal level. Lana is a real creator, she is a genius in all her manifestations, and this is reflected in her work. The songs take you somewhere into the distance, to a sunny flower meadow, where bliss reigns around you and everything is accompanied by Lana's perfect vocals. I am literally drowning in pleasure listening to this album. 10/10",Positive
280,pedro-gomez01,"Mar 19, 2021",10,"<span>Chemtrails over the country club is a masterpiece, even that the album is simple has a lot of deepness and the usual nostalgic dark vibe. It’s fenomenal how the album tell something dark about fame and the beginnings of Lana. 10/10</span>",Positive
281,Chris1008,"Mar 19, 2021",10,<span>Brilliant album. Lana has delivered the Album of the Year once again!! The album is a masterpiece.</span>,Positive
282,RubenAyala,"Mar 19, 2021",10,"<span>Este álbum de Lana se escucha muy maduro, amo que ella siga con sus métodos de crear arte, es lo mejor de Lanita</span>",Positive
283,OmarDelRey,"Mar 19, 2021",10,"<span>I love this new era of Lana, without a doubt delivering something new, innovative and still true to her style, with immersive and impeccable lyrics. I would say that absolutely as a fan for many years, it met and even exceeded my expectations. Rick Nowells and Jack Antonoff also did a very good job along with Lana Del Rey.</span>",Positive
284,Amberh849,"Mar 19, 2021",10,"A SERVEEEEE IF I’VE EVER SEEN ONE ‼️THE VOCALS, MELODY, COLLABS THEY’RE ALL AMAZING",Positive
285,Danielculin,"Mar 20, 2021",10,"Lana Del Rey is serving us a great album once again! There are so many great songs with such vocative lyrics. Songwriting and Lana’s voice are incredible, from the vunlerable voice in White Dress to the raw, country and angry in Dance Till We Die. Her best songs on this album are definetily White Dress, Chemtrails Over The Country Club, Tulsa Jesus Freak, Dark But Just A Game, Not All Who Wander Are Lost, Yosemite and Breaking Up Slowly. Lana Del Rey is again on the top of her game and I hope she will remain there with her next two albums and poetry book that are coming in following months and years.",Positive
286,Romankravchenko,"Mar 19, 2021",10,"<span>С первого прослушивания не вникло восторга, но послушав несколько раз и Понтия смысл текста, я понял, что это лучший альбом</span>",Positive
287,Jkmoses,"Mar 19, 2021",10,"<span>I just love this album through and through. The vocals, the production and me ways she tried in this album with tracks like White Dress and Dance Till We Die. This album, musically, truly takes you back to the late 60s and 70s and heavy influences of Joni and many more.</span>",Positive
288,3838Francisco,"Mar 19, 2021",10,<span>This is a masterpiece. Incredibly well done! Perfect album! I really loved every single song. Congrats to Lana for being such an amazing poet and singer.</span>,Positive
289,Lukehen,"Mar 19, 2021",10,<span>Another masterpiece from the greatest songwriter of this generation. Lana Del Rey just gives and gives and gives.</span>,Positive
290,Tonyyy1,"Mar 19, 2021",10,"<span>Really good ,I love it so much .Dark but just a game is my favorite so far.</span>",Positive
291,diecoast,"Mar 19, 2021",10,"<span>Not less not more than everything we can expect from lana del rey, angelical voice and pure greatness at songwriting</span>",Positive
292,Aymanne,"Mar 19, 2021",9,<span>Honeymoon 2.0<br/>Apart from songs with featured artists Lana delivers a full album of pure delight and enjoyment</span>,Positive
293,clarabacellar,"Mar 19, 2021",10,"<span>Chemtrails Over The Country Club is simply perfect in every single way. Once more, Lana Del Rey has proved she is one of the best, if not the best, artists of our generation.</span>",Positive
295,Maleficent08,"Mar 19, 2021",10,<span>One of her best album. I'm in love with Dark but just a game ! A really good album wich remember me in some ways some of her first albums</span>,Positive
296,gabrielaa,"Mar 19, 2021",10,<span>it's perfect fr. each song has unique construction and the album as a whole makes complete sense. it's really well done and well thought. i'm amazed.</span>,Positive
297,cabeyogoddes,"Mar 19, 2021",10,"<span>A real work of art. Lana Del Rey surprises me more and more in each album she releases, and she never disappoints.</span>",Positive
298,mlm175,"Mar 19, 2021",10,<span>Such a refreshing sound for her and 2021. She truly has mastered songwriting. A beautiful album front to back!</span>,Positive
299,Danielanovo1993,"Mar 19, 2021",10,"Once again, mesmerizing. I am a great Lana del Rey fan, and I've come to realize more and more why. The songs in the album sound even more mature, the lyricism reflects her growth, and how now everything is more suttle, less agitated, and agressive and it's not that it is not sad anymore, but it shows maturity. I really cannot say yet that it can be right next to Ultraviolence and NFR, but it sure is one of her best works. Thank you for your music, really. Best track, probably Dark But Just a Game, although the title track is one of the best of her career.",Positive
300,NatalyWhite,"Mar 19, 2021",10,Really strong and compound album. Very atmospheric. Lana Del Rey is one of those artist that know exactly what they want. Every album is so unique. Definitely high level.,Positive
301,thatsmeagain,"Mar 19, 2021",10,"<span>Chemtrails Over the Country Club proves Lana Del Rey is a musician that should and will be remembered for her artistic range, vocals, and songwriting. Despite being a departure from previous work, Chemtrails is unmistakably Lana, and she is not going anywhere.</span>",Positive
302,mrd666,"Mar 19, 2021",10,"<span>Perfection. That's it. Strem the album. It is talented, brilliant, incredible, amazing, show stopping, spectacular, never the same, totally unique, completely not ever been done before, unafraid to reference or not reference, put it in a blender, **** on it, vomit on it, eat it, give birth to it.</span>",Positive
303,polyn,"Mar 19, 2021",10,<span>amazing she's a fking genius idk why she doesn't have even more recognition</span>,Positive
304,itspaulocezar,"Mar 19, 2021",10,QUE SABOR  DELICIOSO. Lana Del Rey nunca decepciona veyr. Mais um álbum viciante e envolvente do início ao fim. Orgulho de ser fã,Positive
305,madm2401,"Mar 19, 2021",10,<span>Definitivamente COTCC es un recorrido de toda la trayectoria musical se Lana culminando en los que podría ser unos de sus mejores trabajos</span>,Positive
306,danpin,"Mar 19, 2021",10,"After an amazing album as Norman F***ing Rockwell was, Lana comes back to show us how she can improve her lyricism and tells us all this stories with such a beautiful way of writing and just as she said, shes here to showcase her life and true intentions without the media's manipulation, such a beautiful record.",Positive
307,Lucasgrant21,"Mar 19, 2021",10,"Que álbum perfeito, ele começa com White dress te envolvendo, faz conhecer um mundo diferente de lana del rey e fecha com chave de ouro com um cover incrível",Positive
308,bennyb0yy,"Mar 19, 2021",10,<span>This album is amazing!!! The lyrics on this album might just be the best from any of her other albums</span>,Positive
309,Bbydva,"Mar 19, 2021",10,"<span>shes a queen i am so proud of her, every song is a truly masterpiece, im proud of my baby sooooo much</span>",Positive
310,zhong,"Mar 19, 2021",9,<span>beautiful as lana always does！ Deserve a Grammy plz！！！！！！！！</span>,Positive
311,hopeindystopiia,"Mar 20, 2021",10,<span>Album of the year<br/>Album of the year Album of the year Album of the year Album of the year</span>,Positive
312,cokoslut,"Mar 19, 2021",10,<span>She never disappoints❤️. White dress is one of her best of her career. Tulsa Jesus Freak on repeat.<br/>Love u lana!</span>,Positive
313,maxarg,"Mar 19, 2021",10,"<span>This is Lana del Rey most personal album, the lyrics are just so touching and perfect.<br/>Once again miss Del Rey prove she is the queen of the Music Industry.</span>",Positive
314,padwad,"Mar 19, 2021",10,"<span>It there was an album of every song from the bridge of a chick flick movie, this is it, but in it’s best form.</span>",Positive
315,Ilyakarabanov,"Mar 19, 2021",10,"<span>Very awesome, i hope lana win grammy as if the angels were singing in my ears</span>",Positive
316,Maddiiii7,"Mar 19, 2021",10,"<span>Absolutely amazing!! I’ve been listening all day, can’t get enough! Lana has done it again. This album is the perfect mix of soft, fun, and poetic lyrics. Love it so much!</span>",Positive
317,axeldelrey182,"Mar 19, 2021",10,"<span>I love this album more than myself, Lana thanks for the art, thanks for exist, thanks for everything ❤️</span>",Positive
318,Heydennis,"Mar 19, 2021",10,"<span>It has a unique, acid, perfect sound to it. It’s the best on its own way, storytelling and softness are the main characters.</span>",Positive
319,damnyan,"Mar 19, 2021",10,"<span>She is the moment. Lana Del Rey's new album is absolutely perfect, there is no skips songs, you'll get lost in her lyrics and voice. I can already say that is the best album of the year!</span>",Positive
320,Rupankar1999,"Mar 20, 2021",10,"<span>Divinely, if I had to summarize my initial listening experience. Dude, she keeps evolving with her each new LPs. The experimental addition of variable vocal scaling bringing me the tears. Thank you, Angel!!!</span>",Positive
321,Pedrooo,"Mar 19, 2021",10,"<span>Just.. Perfection. Lana del rey's discography is and will forever be iconic, timeless and etherial.</span>",Positive
322,laura123,"Mar 19, 2021",10,"Este álbum sinceramente fue esplendido, no cabe duda que Lana del Rey absolutamente nunca decepciona, es arte de principio a fin. Son melodías que envuelven",Positive
323,shaneh,"Mar 19, 2021",10,One of Lana's best! White Dress is definitely one of her best opening tracks.,Positive
324,OllyAPeters,"Mar 19, 2021",10,"An instant satisfaction, she has done it again. One of her best, just truly a masterpiece.",Positive
325,brrunosouzza,"Mar 19, 2021",10,"Chemtrails Over the Country Club anda de mãos dadas com NFR! e Honeymoon como melhores álbuns da Lana!Consciência, segurança e a objetividade desse álbum me encantaram de uma maneira sem igual. Arriscar em vocais - limpos e puros, como se Lana estivesse bem a nossa frente - não é para qualquer um e aqui, ela fez mais que um singelo álbum: fez um dos melhores trabalhos da carreira.Esperei muito por essas inéditas e ouvi todas como se nunca tivesse ouvido Lana del Rey. Cada álbum, uma inovação, uma novidade e a sensação de ouvir um trabalho perfeito: as músicas se encaixam, se complementam e entramos num mundo tão diferente de NFR!. Impossível querer deixa-lo.",Positive
326,Eloskaa,"Mar 19, 2021",10,<span>Lana keeps surprising us with a great music that feels like a warm hug! Her music is the best thing about this pandemic!</span>,Positive
327,Salissure,"Mar 19, 2021",10,"One of her best !Overall this is a flawless record with,I think, two sides that will please everyone. A more experimental side and then more laid back songs with a more country feels. Lana reinvents herself while sticking to her roots like she always did. Folk influences are immaculate and give Lana’s vocals all their credits. The production is really interesting and detailed too ! It showcases growth and vulnerability while reflecting on what is real happiness and wildness. This albums is a real journey trought fame and all it’s consequences it has on Lana’s life. Goods or bad. Magnificent opus of lana’s vintage sounds !",Positive
328,jrivada,"Mar 19, 2021",10,<span>she has outdone herself again. NFR was already excellent sonically and lyrically. Loving the witchy vibe and the whispery elements some of the songs has. Definitely a shoo-in for Album of the year!</span>,Positive
329,brian0102,"Mar 20, 2021",10,<span>she crafted another body of work its so good coming for AOTY she is the queen purr</span>,Positive
330,Lucasele,"Mar 19, 2021",10,<span>Chemtrails is a amazing album chemtrails over the country club-review by ME!<br/><br/>white dress-10/10⭐️<br/>COTCC-10/10⭐️<br/>Tulsa Jesus freak-9.3/10⭐️<br/>LMLYLAW-8/10<br/>Wild at heart-9.8/10⭐️<br/>DBJAG-10/10⭐️<br/>NAWWAL-10/10⭐️<br/>Yosemite-8.9/10<br/>Breaking up slowly-9.7/10⭐️<br/>Dance till we die-9.7/10⭐️<br/>For free-8.7/10<br/><br/>Overall:90</span>,Positive
331,gustavooluis10,"Mar 19, 2021",10,"<span>This album is just incredible, it's very interesting to notice the evolution of her voice and songwriting compared to the first album there in 2012, I just in love with every single song, it's just perfect. Lana always show us her best in her projects.</span>",Positive
332,NavireNight,"Mar 19, 2021",10,"<span>Perfection, she is finally herself ! An album between goth, folk and alt music, she always recreates music-core</span>",Positive
333,Joaoaoanaof,"Mar 19, 2021",10,<span>I really love it A perfect record Lana is the queen of the alternative and queen of my heart<br/>It's a great album with beautiful Lyrics</span>,Positive
334,diegomoontoya,"Mar 19, 2021",9,"Lana Del Rey's seventh album is an album full of poetry, unfolding with Del Rey's best vocal performance. The production doesn't go unnoticed, it makes the perfect accompaniment to Lana's angelic voice. Without a doubt, Chemtrails Over the Country Club becomes one of the most coherent albums of the year, being that in the last two years we have only seen albums with commercial intentions that have nothing to offer, Lana doesn't do it as is her custom. Problemly, this album has also become the best of her career.Final score: 93",Positive
335,hereditary,"Mar 19, 2021",10,"<span>folky, mellow, dreamy, singer songwriter-y vibes. incredibly wistful, vast and seemingly ""on the brink of something"". lanas vocal delivery and stylisations expresses the points even clearer and add deeper meaning to the story, a la taylor swift's imaginary teenage love triangle saga. though she wrote most before quarantine,  it has the perfect vibe to compliment lockdown.</span>",Positive
336,oiifernando,"Mar 19, 2021",10,"<span>O álbum apresenta altos e ALTOS, inicia-se com white dress uma linda canção e termina com for free de uma maneira que sabemos que o que vem pela frente será algo cada vez melhor feito por del rey. Se eu pudesse dar nota 1000 para esse álbum, eu deria 1001. NFR já nos supreende, mas esse nos aprisiona.</span>",Positive
337,CatheusBueno,"Mar 19, 2021",10,<span>As músicas melhoram a cada momento. Lana foi completamente perspicaz com as letras e a sonografia do álbum.</span>,Positive
338,MONEYPOWER,"Mar 19, 2021",10,"<span>Coesão, talento e aclamação<br/>A cada álbum novo, Lana Del Rey não deixa de surpreender por fazer algo que do começo ao fim é coerente</span>",Positive
339,lordelorentz,"Mar 19, 2021",10,"<span>Um álbum incrível, com uma sonoridade semelhante a de seu antecessor, mas mt bom</span>",Positive
340,laurafmancio,"Mar 19, 2021",10,"<span>completely masterpiece. lana del rey is the best songwriter of our time period. thank you for that, I needed it.</span>",Positive
341,Lucas_ysl,"Mar 19, 2021",10,"Lana del rey always have something to say in their music, this album is divine, and extremely cohesive",Positive
